Title,Content,Date,Url,Summary
Quái vật không gian Alien: Romulus trở lại,"Rạng sáng 5-6 theo giờ Việt Nam, hãng phim 20th Century Studios đã ra mắt trailer đầu tiên cho Alien: Romulus, đánh dấu sự trở lại của dòng phim khoa học viễn tưởng kinh điển Alien, kể từ phần phim cuối cùng năm 2017 - Alien: Covenant.  Trailer Alien: Romulus nhanh chóng thu hút 3,2 triệu lượt xem chỉ trong 12 tiếng, vượt qua một bom tấn Marvel vừa tung trailer là Venom: The Last Dance, cho thấy loạt phim về quái vật không gian vẫn giữ sức hút sau gần nửa thế kỷ ra mắt, kể từ phần phim đầu tiên năm 1979.  Alien: Romulus, tìm về cốt lõi của quái vật không gian Alien: Romulus sẽ lấy mốc thời gian giữa Alien (1979) và Aliens (1986), khi loài người lần đầu phát hiện sinh vật sống ngoài không gian và chạm trán với giống loài nguy hiểm. Hiện những thông tin về cốt truyện vẫn được nhà sản xuất giữ kín, thông qua trailer, ta có thể thấy bối cảnh phim đặt trên một con tàu thám hiểm tương tự phần phim đầu tiên, với những hành lang tăm tối, những con quái vật ngoài hành tinh ẩn nấp chờ chực tấn công phi hành đoàn.  Dưới phần bình luận, những người hâm mộ trung thành của thương hiệu này chỉ ra những góc quay ""đặc sản"" gợi nhớ đến những phần phim đầu tiên trong Alien: Romulus. Có thể kể đến chi tiết quái vật Xenomorph đe dọa nữ chính gợi nhớ đến cảnh quay trong Alien 3, cảnh Face Hugger tấn công và đẻ trứng vào nạn nhân, phân cảnh với tông vàng đen kinh điển của Ridley Scott,... Alien: Romulus sẽ được đạo diễn bởi Fede Àlvarez, một nhà làm phim chuyên thể loại kinh dị, máu me. Một số phim nổi bật do ông đạo diễn: Evil Dead (2013); Don't Breath; Texas Chainsaw Massacre (2022);... Đặc biệt, cha đẻ của thương hiệu Alien là Ridley Scott cũng sẽ theo dõi sát sao dự án dưới vai trò sản xuất.  Trang Variety tiết lộ, đạo diễn Fede Àlvarez đã gửi bản phim Alien: Romulus do chính ông dựng cho Ridley Scott sau khi đóng máy và nhận phản hồi rất tích cực từ ""cha ruột"" của Alien. Nhiều khán giả cũng bày tỏ hy vọng thương hiệu này sẽ trở về thời hoàng kim sau hai phần phim Prometheus và Alien: Covenant thất bại về mặt doanh thu và nhận về nhiều phản ứng trái chiều.",05/06/2024 13:36 GMT+7,https://tuoitre.vn/quai-vat-khong-gian-alien-romulus-tro-lai-20240605123102385.htm,"Dòng phim quái vật không gian trở lại với phần phim thứ chín, Alien: Romulus, ấn định ngày chiếu 16-8 năm nay."
Nhìn từ top 10 phòng vé: Doanh thu phim Việt sai số lung tung,"Trước đây, khán giả và truyền thông Việt phụ thuộc thông tin mà các nhà sản xuất đưa ra để biết doanh thu phim. Có phim công bố, có phim giữ kín. Hiện thông tin doanh thu phim Việt ""thông dụng"" hơn nhờ sự xuất hiện của Box Office Vietnam. Đây là đơn vị thống kê phòng vé độc lập thu thập số lượng vé bán ra từ các trang web bán vé của nhà rạp và nhân với giá vé để ước lượng doanh thu của một phim.  Tuy nhiên, Box Office Vietnam chưa phải đơn vị thống kê được toàn ngành công nhận. Do đó, câu chuyện doanh thu phim tại Việt Nam vẫn còn những điểm mù mờ, gây ảnh hưởng đến quá trình thống kê số liệu, kỷ lục sau này. Sai số lớn, khó căn cứ Phim hoạt hình Doraemon: Nobita và bản giao hưởng Địa Cầu trở thành phim anime ăn khách nhất thị trường Việt Nam vào ngày 3-6, vượt qua phim Conan: Tàu ngầm sắt màu đen.  Nhưng một số bên đăng tải sớm do thông tin không rõ ràng về thời điểm Doraemon đạt 100 tỉ đồng (Conan đạt 96 tỉ đồng). Box Office Vietnam đính chính với Tuổi Trẻ rằng sai số phim Doraemon trên trang web quá cao (15%) do có nhiều mức vé giảm giá cho học sinh, trẻ em... mà họ không ghi nhận được. Còn Lật mặt 7 là ""ca khó"" khi truyền thông phải phụ thuộc duy nhất vào Box Office Vietnam để tham khảo doanh thu phim, còn nhà sản xuất im lặng.  Vì Box Office Vietnam đã thừa nhận mức sai số từ 5 đến 10% tùy từng phim, nên doanh thu Lật mặt 7 trên trang web này có khả năng chênh lệch so với thực tế đến hàng chục tỉ đồng.  Thế nên, doanh thu Lật mặt 7 trên Box Office Vietnam không thể chính xác khi đang hiển thị 466 tỉ đồng (số liệu vào sáng 5-6) Nhà đầu tư một phim Việt có doanh thu trên 60 tỉ đồng vào năm ngoái cho Tuổi Trẻ biết số liệu của phim khi Box Office Vietnam công bố cao hơn thực tế khá nhiều, khiến họ mừng hụt khi dự tính lợi nhuận.  Con số trên trang này có giá trị tham khảo, nhưng để dựa vào đó tính toán lợi nhuận hay thua lỗ trong kinh doanh thì chưa đảm bảo. Top 10 phim Việt mà mỗi phim tính một kiểu Cuối tuần qua, danh sách ""top 10 phim Việt ăn khách nhất"" không rõ nguồn được đăng tải trên một số kênh truyền thông và báo chí. Theo thứ tự từ cao xuống thấp, top 10 gồm: Mai, Nhà bà Nữ, Lật mặt 7, Bố già, Lật mặt 6, Cua lại vợ bầu, Hai Phượng, Tiệc trăng máu, Em chưa 18, Mắt biếc. Điều bất hợp lý là ngay trong danh sách, nguồn tham khảo doanh thu của từng phim lại khác nhau, không có một thang chung chuẩn mực. Có phim ghi theo Box Office Vietnam, có phim ghi theo thông tin từ nhà sản xuất, có phim không rõ nguồn thống kê. Chẳng hạn, phim Mai của Trấn Thành đứng đầu được ghi nhận 524 tỉ đồng. Con số do nhà sản xuất công bố là 520 tỉ đồng, con số do Box Office Vietnam hiển thị là 551 tỉ đồng. Danh sách ghi Hai Phượng có doanh thu nội địa 185 tỉ đồng. Trên thực tế, phim từng được nhà sản xuất công bố doanh thu 200 tỉ đồng bao gồm cả thị trường Việt Nam và quốc tế chứ không tách riêng, không rõ 185 tỉ đồng được ghi nhận theo cách tính nào. Phim Mắt biếc (được cho là đứng thứ 10) nhiều năm nay được nhiều tờ báo ghi nhận là thu 180 tỉ đồng, thì trong danh sách ghi 164 tỉ đồng do căn cứ theo Box Office Vietnam. Trong khi nếu danh sách sử dụng con số 180 tỉ đồng thì Mắt biếc có thể đứng thứ 8. Hay phim Tiệc trăng máu, danh sách này ghi 174 tỉ đồng, từng được nhà sản xuất công bố doanh thu 177 tỉ đồng, trên Box Office Vietnam ghi 172 tỉ đồng. Các con số này sai khác không lớn nhưng để xét thứ hạng trong top 10 thì quan trọng vì doanh thu Em chưa 18 cũng được danh sách ghi nhận 172 tỉ đồng. Theo tìm hiểu của Tuổi Trẻ, danh sách này là số liệu thống kê nội bộ của một đơn vị phát hành phim tại Việt Nam, không phải để công bố công khai như top 10 ""chuẩn chỉnh"" của thị trường. Thông thường, các đơn vị phát hành riêng lẻ chỉ có số liệu chính xác về các phim họ tự phát hành, còn phim của nhà phát hành khác thì buộc phải tham khảo Box Office Vietnam hoặc các nguồn tin khác, có cả ""nghe đồn"".  Con số doanh thu cũng phải làm tròn để dễ phổ biến trong nội bộ chứ không sát thực đến từng số lẻ sau dấu phẩy. ",05/06/2024 09:18 GMT+7,https://tuoitre.vn/nhin-tu-top-10-phong-ve-doanh-thu-phim-viet-sai-so-lung-tung-20240604224843258.htm,"Doraemon được đưa tin đạt 100 tỉ đồng hôm 2-6, nhưng con số đó chưa đúng. Lật mặt 7: Một điều ước tự công bố thuộc 3 phim Việt ăn khách nhưng không đưa ra con số doanh thu cụ thể nào."
Mười năm Tuần lễ thời trang quốc tế Việt Nam,"Tuần lễ thời trang quốc tế Việt Nam (Vietnam International Fashion Week) bắt đầu từ năm 2014, đến nay bước vào mùa thứ 17, được xem là sự kiện thời trang chuyên nghiệp và quy mô lớn. Thông điệp của mùa thứ 17 là những bước tiến mới của thời trang Việt. Năm nay, sự kiện đầu tiên trong chuỗi sự kiện kỷ niệm một thập niên của Tuần lễ thời trang quốc tế Việt Nam 2024 sẽ bắt đầu tại TP.HCM và kết thúc ở thủ đô Hà Nội. Hòa cùng xu hướng chung của thời trang thế giới, những năm qua Tuần lễ thời trang quốc tế Việt Nam hướng đến phát triển thời trang bền vững khi khuyến khích các nhà thiết kế sử dụng nguyên liệu tự nhiên hoặc tái chế từ tơ sen, vỏ hàu, chai nhựa, thân tre... Tuần lễ thời trang quốc tế Việt Nam 2024 có sự tham gia của 16 nhà thiết kế, thương hiệu thời trang trong nước và quốc tế. Trong đó có nhiều nhà thiết kế tham gia từ những mùa đầu tiên như Thủy Nguyễn, Võ Công Khanh, Adrian Anh Tuấn, Hoàng Minh Hà, Hà Linh Thư, Vũ Việt Hà, Lý Giám Tiền... Và có sự góp mặt của các nhà thiết kế quốc tế như Chung Chung Lee (Hàn Quốc), Frederick Lee (Singapore), Giovanna Costa (Ý)... Nhà thiết kế Võ Công Khanh diễn mở màn với bộ sưu tập ""Kiệt tác của nước"" và Vũ Việt Hà diễn kết màn tuần lễ thời trang năm nay bằng bộ sưu tập ""Cô ấy là ai"". Đây cũng là sự trở lại sau 5 năm của nhà thiết kế Thủy Nguyễn. Chị tiếp tục sử dụng chất liệu lụa và gấm để thực hiện bộ sưu tập ""Lả lơi áng mây trôi"", dù chị bảo chính vì trung thành với hai chất liệu này như là thách thức, cũng tự hạn chế mình trong sáng tạo thời trang. Trong khuôn khổ Tuần lễ thời trang quốc tế Việt Nam 2024 có nhiều hoạt động như triển lãm Dệt may Ý; Phong cách và đột phá (ngày 13-6); Chụp ảnh The Best Street Style dành cho các tín đồ thời trang, tại Diamond Plaza (TP.HCM, từ ngày 13 đến 16-6); Cũng trong thời gian từ ngày 13 đến 16-6 sẽ diễn ra các show diễn thời trang tại nhà thi đấu Quân khu 7 (TP.HCM). ",05/06/2024 07:55 GMT+7,https://tuoitre.vn/muoi-nam-tuan-le-thoi-trang-quoc-te-viet-nam-20240604225941704.htm,"Năm 2024 đánh dấu một thập niên của Tuần lễ thời trang quốc tế Việt Nam, đưa thời trang Việt ra thế giới và mang thời trang thế giới về Việt Nam."
"7 năm chưa cưới sẽ chia tay: Thúy Ngân, Jun Phạm từ yêu thành hận","Chiều tối ngày 4-6, bộ phim 7 năm chưa cưới sẽ chia tay ra mắt báo chí.  Hai diễn viên Jun Phạm và Thúy Ngân và các diễn viên Trung Dũng, Võ Cảnh, đạo diễn - biên kịch Nguyễn Hoàng Anh đã có những chia sẻ về vai diễn. Trong phim, Jun Phạm và Thúy Ngân đóng vai từ yêu thành hận. Thúy Ngân, Jun Phạm làm mới mình 7 năm chưa cưới sẽ chia tay được làm lại từ phim Hàn Quốc nổi tiếng Secret love. Khi biết Thúy Ngân vào vai của diễn viên Hwang Jung Eum, nhiều ý kiến cho rằng cô không đủ sức. Về các ý kiến này, Thúy Ngân bảo: ""Khi nhận kịch bản tôi thấy đạo diễn Hoàng Anh viết lại đọc khá là khác với kịch bản gốc. Phim thay đổi nhiều tuyến nhân vật, các tình tiết cũng đảo lộn sao cho phù hợp về lối sống, con người và thời đại năm 2024.  Vì vậy tôi hoàn toàn tập trung vào kịch bản hiện tại, không theo dõi kịch bản cũ nước ngoài. Tôi diễn sao cho nhân vật mượt mà, thể hiện đường dây câu chuyện tốt nhất"". Thúy Ngân cũng cho rằng khi đọc những bình luận chị không để tâm lắm mà hết lòng cho nhân vật mình hơn vì biết đây là bộ phim hay.  Mặt khác, các ý kiến xuất hiện sau khi phim đóng máy nên cũng không ảnh hưởng lắm. ""Những gì mình thể hiện vừa qua tôi tin đây sẽ là sản phẩm đáng mong đợi trong sự nghiệp diễn xuất của mình. Tôi đã dùng hết công sức cũng như là rèn luyện mình thành con người khác với Thúy Ngân trước đây"", Thúy Ngân nói thêm. Còn Jun Phạm thì cho biết mình không quá kỳ vọng về vai diễn, khán giả là người quyết định nhưng đã làm hết sức mình. Anh nói: ""Vai diễn luật sư Tuấn Kiệt là cơ hội quý báu với tôi. Từ đó giờ các đạo diễn đo ni đóng giày tôi những vai hòa đồng, ngoan ngoãn.  Đạo diễn Hoàn Anh cho tôi cơ hội bằng cách ""đập vỡ"" tôi từ từ. Trước là phim Nữ chủ và đến phim này. Vai hay thật nhưng quá khác với tôi. Và tôi khá áp lực trong 6 tháng gắn bó với Tuấn Kiệt"". 7 năm chưa cưới sẽ chia tay khác với bản gốc 7 năm chưa cưới sẽ chia tay do Nguyễn Hoàng Anh biên kịch và đạo diễn. Phim thuộc thể loại tình cảm buồn (melodrama), xoay quanh câu chuyện về giám đốc đẹp trai, nhà giàu Minh Huy phải lòng cô gái Thiên Ân ngây thơ và ngoan cường, người có liên quan đến cái chết của bạn gái anh.  Khi mối quan hệ giữa hai người trở nên gắn kết, những bí mật che giấu bắt đầu sáng tỏ. Đạo diễn Hoàng Anh chia sẻ cô rất thích bản gốc của Hàn Quốc từ 10 năm trước rồi nên khi được giao nhiệm vụ làm phim không bị áp lực. Thế nhưng lại gặp nhiều khó khăn trong quá trình thực hiện, ""Secret love nhìn câu chuyện có vẻ như nói về chuyện tình yêu nhưng thực ra phim phản ánh mạnh mẽ xã hội Hàn Quốc bấy giờ. Vì thế khi chuyển thể cần nhiều thay đổi để phù hợp với văn hóa và con người Việt, và nhất là phù hợp với xã hội hiện đại bây giờ.  Tôi đã thêm bớt một số tuyến nhân vật, nội dung cũng chỉnh sửa khá nhiều"", đạo diễn chia sẻ. 7 năm chưa cưới sẽ chia tay được đầu tư khá kỹ. Phim dài 25 tập quay trong suốt 6 tháng.  Ngoài Thúy Ngân, Jun Phạm, phim còn quy tụ dàn diễn viên Võ Cảnh, Thanh Nam, Trung Dũng, Đào Vân Anh, Nguyệt Ánh, Lê Bê La, Khánh Huyền, Dương Hoàng Anh, Lê Khánh, Tuấn Khải, Ngân Hòa, Duy Khánh ZhouZhou, Phương Hằng, Trương Minh Thảo. Phim lên sóng VieON lúc 20h thứ năm và sáu hằng tuần, bắt đầu từ ngày 6-6.",04/06/2024 21:13 GMT+7,https://tuoitre.vn/7-nam-chua-cuoi-se-chia-tay-thuy-ngan-jun-pham-tu-yeu-thanh-han-20240603170711168.htm,"Nói về những ý kiến so sánh vai diễn của mình trong phim '7 năm chưa cưới sẽ chia tay' với phiên bản gốc, Thúy Ngân bảo cô không bận tâm lắm vì mình đã hết lòng với nhân vật."
"Bức xúc với những phi lý quá sức chịu đựng, câu view phản cảm của Dâu hào môn","""Chưa thấy có bộ phim nào mà vô lý như phim này, quá sức chịu đựng"", ""Phim này coi có cảm nhận gia đình gia tộc gì mà phong thủy quá, xem xong như học phong thủy, giàu nhờ phong thủy, làm dâu coi tới lui có liên quan đẻ, cúng kiếng"", ý kiến khán giả nhận xét về phim Dâu hào môn. Nước tiểu trẻ em là biểu tượng thiêng liêng? Dâu hào môn bắt đầu câu chuyện khi Linh (Tú Vi) vì cứu gia đình đang lâm vào cảnh nợ nần nên đồng ý vào làm dâu cho một gia đình hào môn.  Những tưởng cô gái này có cuộc sống sung sướng, nhưng không, Linh trở thành ""công cụ sinh sản"" cho dòng họ Nguyễn Phó. Cô đã chịu đựng, đối phó với những thành viên trong gia đình xảy ra những cuộc tranh giành tiền bạc, quyền lực. Ngay từ những tập đầu tiên, phim đã gieo rắc cho khán giả sự hoang mang bởi câu chuyện phim thời nay mà tưởng như xã hội thời phong kiến xa xưa. Trước khi bước vào nhà chồng, Linh có nghi lễ gia tiên, cô dâu xúng xính trong chiếc áo dài đỏ, quỳ lạy trước mặt mình là một… con heo. Rồi sau nghi lễ gia tiên, đến nghi lễ tẩy trần kỳ lạ. Và càng kỳ lạ hơn gia đình hào môn có kiểu sống đầy mê tín dị đoan, hủ tục quái gở như con dâu không được ngồi ăn chung bàn với gia đình chồng, phải túc trực phục vụ gia đình chồng và chồng.  Khi chồng đi làm về phải chuẩn bị một thau nước lá bưởi vừa đủ 40 độ để chồng rửa chân. Rồi Linh và chị bạn dâu bị đưa ra ngồi ngoài hiên từ tối đến sáng để hứng ""lộc trời cho đến khi mặt trời mọc"", như lời chị bạn dâu giải thích:  ""Vào 4h sáng, khi giọt sương đầu tiên rơi xuống, thì đó cũng chính là lộc trời. em phải ra đây ngồi đúng vị trí này để hấp thụ tinh hoa của trời đất thì mới mau chóng đậu thai quý tử được"". Chị Thanh An, quận Bình Tân khi xem phim đã phản ứng với chi tiết mẹ chồng cho hai con dâu uống nước tiểu trẻ nhỏ với lời giải thích của mẹ chồng:  ""Uống nước tiểu của bé trai dưới 8 tuổi để xin vía con trai bỏ bụng. Nó được cho là một loại nước sạch, biểu tượng của sự thiêng liêng, sức mạnh của nam tính, may mắn thành công, có khả năng thanh tẩy tinh thần từ các năng lượng tiêu cực"". Linh phản ứng về hành động này của mẹ chồng là phản khoa học. Nhưng lý giải của cô về nước tiểu trẻ em xưa khác với nước tiểu trẻ em ngày nay cũng ngây ngô vô cùng.  Cô cho rằng trẻ em ngày xưa ăn uống sạch sẽ hơn nên có thể nước tiểu cũng như vậy nhưng bây giờ trẻ em ăn nhiều những thực phẩm khác nhau, chế độ ăn uống không còn như xưa nữa thì độc. Câu view nhưng đừng nguy hại Xem Dâu hào môn dồn dập nhiều bi kịch. Đến nay, khi phim đi được hơn nửa đoạn đường, kịch tính đẩy cao trào. Hóa ra hai người con trai Tài (Steven Nguyễn), Bảo (Trung Huy) của bà Xuân - mẹ chồng Linh (Ngân Quỳnh) đều không phải do bà sinh ra và mỗi người đều có những âm mưu chiếm đoạt tài sản.  Linh, Diệp đều là những quân cờ tính toán các thành viên của gia đình lạ lùng này. Và ai là trùm cuối, kẻ đứng sau những âm mưu đen tối đang dần lộ diện. Dâu hào môn được thực hiện theo dạng phim ngắn, quay dọc, thời lượng mỗi tập ngắn khoảng 5 phút.  Vì đây là phim phát trên nền tảng số nên sự kiểm duyệt không khắt khe bằng phim truyền hình. Đẩy mạnh những yếu tố giật gân như cho con dâu uống nước tiểu, hành hạ thân thể người khác bằng việc gí cây nhang đang cháy vào lưng, Dâu hào môn thành công trong việc thu hút đông khán giả xem bởi sự tò mò. Khi bộ phim đưa lên YouTube đạt cả triệu view, nhận nhiều ý kiến phản hồi. Thế nhưng như ý kiến chị An: ""Phim Dâu hào môn view cao nhờ khai thác những yếu tố lạ, ít phim khai thác.  Nhưng có những chi tiết, thông tin hủ lậu đáng bị lên án thì phim lại đề cập đến như chi tiết trong xã hội hiện nay thì quá phi lý, nguy hại"". Chị đặt câu hỏi: ""Kể câu chuyện như vậy mục tiêu phim là gì? Liệu nó có gây ảnh hưởng đến thị hiếu xã hội, và liệu phim có đi ngược lại với việc xây dựng thị trường phim lành mạnh, văn minh?"".",04/06/2024 21:01 GMT+7,https://tuoitre.vn/buc-xuc-voi-nhung-phi-ly-qua-suc-chiu-dung-cau-view-phan-cam-cua-dau-hao-mon-20240604163637653.htm,"Nhiều người xem bức xúc khi phim 'Dâu hào môn' phát sóng trên nền tảng số có những chi tiết vô lý, thậm chí phản khoa học."
Quyền Linh mời đạo diễn phim ăn khách nhất Hàn Quốc đến Việt Nam,"Chương trình giao lưu có tên là Cinework ""Đường đến Liên hoan phim quốc tế Busan"", diễn ra từ ngày 24 đến 26-6 tại TP.HCM. Đạo diễn Kim Han Min trở lại Việt Nam Khách mời quốc tế nổi bật là đạo diễn Kim Han Min của phim The Admiral: Roaring Currents (Đại thủy chiến) - phim ăn khách nhất phòng vé Hàn Quốc. Ngoài ra còn có bà Ellen Y.D Kim - giám đốc thị trường phim và nội dung châu Á (ACFM) của Liên hoan phim Busan (BIFF) 2024; ông Jeon Chanil - nhà phê bình điện ảnh và nguyên giám đốc Viện phim BIFF. Phía Việt Nam có đạo diễn, nhà sản xuất Lương Đình Dũng (Cha cõng con, 578 - Phát đạn của kẻ điên, Thành phố ngủ gật), đạo diễn Trần Thanh Huy (phim Ròm, đoạt giải New Currents tại Liên hoan phim Busan 2019). Bộ phim The Admiral: Roaring Currents của đạo diễn Kim Han Min ra mắt năm 2014.  Sau 10 năm, đây vẫn là bộ phim đứng đầu phòng vé Hàn Quốc, có 17,6 triệu lượt xem và doanh thu toàn cầu 138,3 triệu USD. Ngoài ra, đạo diễn Kim Han Min còn thực hiện các bộ phim Hàn Quốc nổi tiếng như Hansan: Rising Dragon, Noryang: Deadly Sea, War of the Arrows... Ông từng đoạt giải Rồng Xanh, Chuông Vàng, giải của Hiệp hội Phê bình phim Hàn Quốc... và được đề cử giải Baeksang. Trung tâm của Quyền Linh sẽ mời nhiều chuyên gia quốc tế Cinework ""Đường đến Liên hoan phim quốc tế Busan"" do Trung tâm Phát triển điện ảnh tổ chức, nằm trong chuỗi hoạt động đưa các chuyên gia hàng đầu về điện ảnh thế giới đến Việt Nam. Các hoạt động này của trung tâm nhằm mục tiêu giúp các nhà làm phim trong nước nâng cao trình độ chuyên môn, mở rộng mạng lưới quan hệ và học hỏi kinh nghiệm quốc tế, từ đó thúc đẩy sự phát triển và đổi mới sáng tạo trong sản xuất phim. Nghệ sĩ Quyền Linh, giám đốc Trung tâm Phát triển điện ảnh, nhấn mạnh: ""Liên hoan phim quốc tế là một trong những con đường ngắn nhất để đạt thành công trong lĩnh vực điện ảnh. Một bộ phim đoạt giải hoặc trình chiếu tại một liên hoan phim quốc tế uy tín sẽ thu hút sự chú ý của khán giả và giới chuyên môn toàn cầu. Các chợ phim tại liên hoan phim là nơi thúc đẩy giao dịch và hợp tác giữa các nhà sản xuất, phân phối và đầu tư từ khắp nơi trên thế giới"". Phó giáo sư, tiến sĩ Đỗ Lệnh Hùng Tú - chủ tịch Hội Điện ảnh Việt Nam - chia sẻ:  ""Sự kiện lần này của Trung tâm Phát triển điện ảnh là một bước tiến quan trọng, thể hiện cam kết của Hội Điện ảnh Việt Nam trong việc xây dựng một nền điện ảnh chuyên nghiệp, sáng tạo và hội nhập quốc tế"".",04/06/2024 19:53 GMT+7,https://tuoitre.vn/quyen-linh-moi-dao-dien-phim-an-khach-nhat-han-quoc-den-viet-nam-20240604181038576.htm,"Trung tâm Phát triển điện ảnh do Quyền Linh làm giám đốc sẽ tổ chức chương trình giao lưu quốc tế cuối tháng 6, mời đạo diễn Kim Han Min của phim 'The Admiral: Roaring Currents'."
