Title,Content,Date,Url,Summary
Tin tức giải trí 3-6: Em gái khuyên Angela Phương Trinh ngừng phát ngôn thiếu kiểm soát,"Em gái ruột khuyên nhủ Angela Phương Trinh Tối 2-6, Phương Trang, em gái Angela Phương Trinh, lên tiếng khi chị gái có những phát ngôn gây tranh cãi về tôn giáo, xã hội.  Phương Trang cho biết từ lâu, chị gái mình đã không liên lạc với gia đình để chia sẻ vấn đề cá nhân.  Em gái Angela Phương Trinh nói cô và người thân đau lòng, cố gắng khuyên nhủ nữ diễn viên ngừng công kích người khác và phát ngôn thiếu kiểm soát trên mạng xã hội nhưng không nhận được sự phản hồi.  Cô viết trên trang cá nhân, xưng hô ""con"": ""Chị con cũng không còn là người chị mà con biết của trước kia vì những gì mà chị con thể hiện bây giờ không giống như những gì chị đã dạy con trước đây.  Những ngày qua con im lặng không phải vì con ủng hộ sự việc diễn ra như vậy... nhưng đây là cách cuối cùng con dùng đến và con đã phải suy nghĩ rất nhiều để đưa ra quyết định khó khăn này giúp gia đình con khỏi nguy hiểm, đe dọa và còn để sinh sống hằng ngày"". Trước đó Angela Phương Trinh liên tục đăng những thông tin gây tranh cãi trên Facebook liên quan ông Thích Minh Tuệ, nhằm hạ thấp uy tín của một số cá nhân, tổ chức. Hiện bài viết đăng gần nhất trên Facebook Angela Phương Trinh vào trưa 2-6, có những ngôn từ nặng nề. Các bài viết của Angela Phương Trinh đã giới hạn người bình luận. Super Junior gửi lời chào fan Việt trước concert tại Việt Nam Trưa 3-6, nhóm nhạc Super Junior đã đăng tải clip gửi lời chào đến fan Việt trước thềm conert sắp diễn ra tại Nhà thi đấu Phú Thọ (TP.HCM). Trong clip, các thành viên nhóm nhạc chia sẻ: ""Xin chào các bạn E.L.F. Việt Nam. Thời gian qua, các bạn đã chờ đợi rất lâu rồi và điều mà các bạn mong đợi cuối cùng cũng đã đến. Super Junior sắp đến gặp các bạn rồi đây. Tụi mình đang rất hào hứng để chuẩn bị cho những tiết mục hết sức mới mẻ. Mong rằng các bạn sẽ đón chờ thật nhiều nha. Hẹn gặp các bạn ở buổi concert"".  Concert Super Junior Super show spin-off: Halftime sẽ diễn ra vào lúc 17h ngày 28-7 tới tại Nhà thi đấu Phú Thọ, TP.HCM. Lật mặt 7 có thật sự đã vượt Nhà bà Nữ? Trưa 3-6, đơn vị thống kê phòng vé độc lập Box Office Vietnam công bố phim Lật mặt 7: Một điều ước đã vượt mốc 464 tỉ đồng, qua đó vượt phim Nhà bà Nữ (số liệu trên Box Office Vietnam là 459 tỉ đồng) để trở thành phim ăn khách thứ hai Việt Nam, chỉ sau phim Mai. Nhưng doanh thu Nhà bà Nữ do nhà sản xuất công bố vào năm 2023 là 475 tỉ đồng. Bên cạnh đó, theo nguồn tin riêng của Tuổi Trẻ Online, sai số doanh thu Lật mặt 7 trên Box Office Vietnam so với thực tế có thể lên đến trên dưới 30 tỉ đồng.  Do đó, việc phim đã thực sự vượt qua Nhà bà Nữ hay chưa, chỉ có thể đợi con số chính thức được công bố từ nhà sản xuất của Lật mặt 7. Jungkook (BTS) sắp ra ca khúc mới giữa lúc nhập ngũ Tối 2-6, Big Hit Music thông báo Jungkook (BTS) sẽ phát hành một bài hát mới mang tên Never let go vào ngày 7-6. Ca khúc là lời tri ân chân thành gửi đến người hâm mộ của Jungkook với thông điệp “không bao giờ buông tay nhau”, “một minh chứng của lòng biết ơn đến tình yêu thương vô bờ bến của ARMY trên khắp thế giới”. Thông tin Jungkook ra mắt ca khúc mới trong lúc nhập ngũ đã gây xôn xao. Trên mạng xã hội X, từ khóa “Jungkook is coming"" lọt top 5 xu hướng toàn cầu. Trước đó, ca khúc Seven của Jungkook ra mắt ở vị trí số 1 bảng xếp hạng Billboard Hot 100, vượt qua Flowers của Miley Cyrus để trở thành ca khúc đạt 100 triệu lượt phát trực tuyến nhanh nhất lịch sử Spotify toàn cầu. Phước Sang nói tình yêu thương của các con giúp anh chiến đấu bệnh tật Gặp lại diễn viên Việt Trinh, biên kịch Châu Thổ, làm khách mời trong chương trình 24 giờ gieo hạt yêu thương, Phước Sang diện quần jeans, áo thun đỏ, thân hình gầy gò.  Xuất hiện lần đầu sau đột quỵ não, anh nói nhờ con trai 17 tuổi tắm rửa, chăm sóc, anh hồi phục dần. Phước Sang cho biết tình yêu thương của các con giúp anh chiến đấu bệnh tật. Mỗi sáng trước khi đi học, con trai lớn của anh tắm rửa, vệ sinh cơ thể cho bố. Tối ở nhà, cậu bé đút cơm và thu xếp mền, gối nhắc bố ngủ, uống thuốc đúng giờ.  ""Gặp biến cố về sức khỏe, tôi thấy rõ sự hiếu thảo, hiểu chuyện của con. Điều này là động lực, tinh thần giúp tôi vượt qua thời điểm ngặt nghèo. Tôi trân trọng cuộc sống hơn và ráng bình phục để còn lo cho chúng"", anh nói. Hồi tháng 3, Phước Sang nhập viện cấp cứu vì đột quỵ não. Trước đó, anh cũng trải qua hai lần đột quỵ. Một nhân viên lễ tân thắng Britain's Got Talent Theo truyền thông Anh, Sydnie Christmas, một nhân viên lễ tân, vừa giành giải cao nhất sau khi thể hiện ca khúc nhạc phim The Wizard of Oz (1939) trong đêm chung kết Britain's Got Talent.  Sau khi phần thi kết thúc, ban giám khảo đồng loạt đứng dậy, khen tiết mục của cô đầy cảm xúc, hoàn hảo.  Christmas nghẹn ngào phát biểu nhận giải: ""Tôi thật sự không biết phải nói gì. Không thể tin khán giả dành nhiều tình cảm cho mình từ khi chương trình lên sóng"".  Sydnie Christmas hiện là nhân viên lễ tân tại phòng gym địa phương. Sau khi thắng Britain's Got Talent, cô nói vẫn làm việc tại chỗ cũ vì đã ký hợp đồng.",03/06/2024 16:32 GMT+7,https://tuoitre.vn/tin-tuc-giai-tri-3-6-em-gai-khuyen-angela-phuong-trinh-ngung-phat-ngon-thieu-kiem-soat-20240603154946322.htm,Một số tin tức đáng chú ý: Em gái ruột khuyên Angela Phương Trinh ngừng phát ngôn thiếu kiểm soát; Super Junior gửi lời chào fan Việt trước thềm concert tại Việt Nam; Lật mặt 7 có thật sự đã vượt Nhà bà Nữ?...
Connection: Có một Ji Sung đầy những bí mật,"Connection (Mối liên kết bí ẩn) thuộc thể loại tội phạm - kinh dị, là bộ phim đánh dấu sự trở lại của ""ông hoàng diễn xuất"" Ji Sung sau Adamas (2022).  Phim phát sóng trên Đài SBS (Hàn Quốc) và song song chiếu tại Việt Nam trên các kênh có bản quyền là FPT, Vieon và TV360. Ngay khi ra mắt, Connection đã thành công đứng đầu khung giờ phim phát sóng tối thứ sáu - thứ bảy, đồng thời trở thành miniseries Hàn Quốc có rating cao nhất tuần, vượt qua Lovely Runner (4,8%), The Atypical Family (4,2%), The Midnight Romance in Hagwon (4,9%)... Niềm kỳ vọng của truyền hình Hàn Sau khi Queen of Tears kết thúc, truyền hình Hàn bước vào giai đoạn khủng hoảng rating. Không có bộ phim nào tạo được hiệu ứng gây sốt tương tự và vượt qua được mốc 5% tỉ suất người xem.  Sự xuất hiện của Connection với thành công của những tập phim đầu được kỳ vọng giúp truyền hình Hàn hút trở lại. Connection xoay quanh nhân vật chính là Jang Jae Kyung (Ji Sung) - cảnh sát xuất sắc của đội đặc nhiệm phòng chống ma túy. Tài năng trong công việc nhưng anh có tính cách lạnh lùng, khó gần, luôn tránh xa bạn bè và gia đình. Trong một phi vụ, Jae Kyung bị hãm hại nên đã trở thành con nghiện ma túy. Lần theo các manh mối, anh bị cuốn vào vụ án bí ẩn liên quan đến cái chết của một người bạn thời trung học.  Cùng với nữ nhà báo tài năng Oh Yoon Jin (Jeon Mi Do), cả hai đã kết hợp để tìm ra chân tướng sự việc, vạch trần âm mưu của tổ chức tội phạm tham nhũng, buôn bán ma túy khét tiếng. Connection mở đầu bằng sự việc trớ trêu: Một cảnh sát điều tra ma túy vô tình trở thành tội phạm ma túy.  Nhân vật chính không còn lựa chọn nào khác ngoài cố gắng che giấu sự việc, vừa nỗ lực truy bắt tội phạm vừa chống chọi lại những ham muốn, cám dỗ của bản thân. Hoàn cảnh trớ trêu đặt ra giúp phim có tiền đề tốt để triển khai cốt truyện gay cấn, hấp dẫn, gây tò mò phía sau.  Nhịp phim nhanh và lôi cuốn đem đến sự ma mị, bí ẩn cho tác phẩm, dù nội dung chưa quá nặng nề, u ám trong những tập đầu. Bối cảnh phim bao trùm bởi không gian lạnh lẽo, ngột ngạt, từ văn phòng cảnh sát, nghĩa trang, những căn hộ chật hẹp, tối đèn... cho thấy hiện thực xã hội tàn khốc, bao phủ bởi những suy nghĩ, hành động đen tối, thể hiện dục vọng tầm thường của con người. Connection cũng thêm thắt khéo léo những ""khoảng thở"" cho bộ phim bằng việc đan cài cảnh hồi tưởng trong quá khứ, khi các nhân vật chính là những cô cậu học trò và được gắn kết với nhau bởi tình bạn bè trong sáng. Dù kể một câu chuyện trinh thám đen tối, phim vẫn mang sắc thái ấm áp nhờ những chi tiết về tình người, tình bằng hữu, đồng chí, gia đình...  Bên cạnh một bộ phận con người tham lam, bán mình cho đồng tiền, vẫn còn đó những giá trị đạo đức tốt đẹp, là kim chỉ nam đưa những bí mật kinh hoàng bị che giấu ra ánh sáng. Vai diễn nặng tâm lý của Ji Sung Với Connection, không phải lần đầu Ji Sung đảm nhận một vai diễn nặng chiều sâu tâm lý.  Trước đó, nam diễn viên thuộc trường phái thực lực của Hàn Quốc từng một lúc đóng bảy vai khác nhau khi hóa thân chàng trai đa nhân cách trong Kill Me Heal Me, hay bác sĩ tài giỏi nhưng mắc căn bệnh CIPA (vô cảm với nỗi đau) trong Doctor John. Connection một lần nữa cho thấy ""gu"" chọn kịch bản độc đáo và thích thử thách bản thân của Ji Sung. Trả lời phỏng vấn của Soompi, anh chia sẻ lý do trở thành Jang Jae Kyung trên màn ảnh: ""Tôi chưa từng thể hiện hình ảnh một cảnh sát vướng vào ma túy bao giờ. Jang Jae Kyung còn là một nhân vật cô đơn, anh ta không tin vào tình bạn. Tôi nghĩ Connection là kịch bản mà tất cả người xem có thể cân nhắc thưởng thức ít nhất một lần.  Bộ phim truyền hình này không đưa ra giải pháp cho các vấn đề xã hội mà ma túy gây ra, nhưng thông qua những lựa chọn của Jae Kyung, nó có thể mang lại nhiều hơn sự can đảm trong xã hội của chúng ta"", tài tử bộc bạch. Và Ji Sung đã không làm khán giả chờ đợi anh thất vọng khi mang đến một nhân vật luôn đứng giữa lằn ranh của những giằng xé, ám ảnh, hy vọng và tổn thương ngay từ tập phim đầu tiên. Đặc biệt, bên cạnh những cảnh hành động, rượt đuổi mãn nhãn, cảnh phim Ji Sung hóa thân thành người vật lộn với cơn nghiện ma túy trong khi làm nhiệm vụ cảnh sát là điểm nhấn nổi bật, thuyết phục về mặt diễn xuất, giúp Connection nhận nhiều lời khen ngợi và đánh giá tích cực. Đồng hành cùng Ji Sung là ""bông hoa nở muộn"" của điện ảnh Hàn Quốc - Jeon Mi Do - người cũng cho thấy kinh nghiệm dày dạn của cô.  Là vai chính thứ ba trong sự nghiệp sau Hospital Playlist (2020, 2021) và Thirty Nine (2022), Jeon Mi Do cho thấy cô sẵn sàng bứt phá khỏi giới hạn an toàn của bản thân, nhận một vai diễn gai góc, táo bạo và nhiều thử thách hơn. Sự kết hợp của Ji Sung và Jeon Mi Do mang đến những nút thắt mở nhịp nhàng cho câu chuyện hứa hẹn còn nhiều tiềm năng khai phá của Connection. ",03/06/2024 15:08 GMT+7,https://tuoitre.vn/connection-co-mot-ji-sung-day-nhung-bi-mat-20240603094336741.htm,Connection một lần nữa cho thấy gu chọn kịch bản độc đáo và thích thử thách bản thân của Ji Sung trong những vai diễn tâm lý hạng nặng.
"Khán giả vỗ tay không ngớt, thầy trò Đặng Thái Sơn 'đãi' thêm bản piano tám tay","Hòa nhạc Timeless Resonance - Thanh âm bất tận mở màn với chương I Đặng Thái Sơn và các học trò diễn ra tối 2-6 tại Nhà hát lớn Hà Nội. Tối nay (3-6), chương trình sẽ được diễn ra tại Nhạc viện TP.HCM. Đêm diễn nằm trong tour lưu diễn vòng quanh thế giới của thầy trò Đặng Thái Sơn. Việt Nam là địa điểm đầu tiên trong hành trình đó. ""Đãi"" thêm bản piano tám tay Trước đó, tại họp báo hôm 22-5, NSND Đặng Thái Sơn chia sẻ trong đêm nhạc mở màn này, thầy trò ông sẽ chơi những tác phẩm từ cổ điển tới hiện đại. Bên cạnh những tiết mục độc tấu, ông và học trò sẽ chơi những bản piano bốn tay. Vì thế, việc cả bốn thầy trò cùng xuất hiện trên sân khấu, chơi piano tám tay để ""đãi"" thêm khán giả Hà Nội ở phút cuối là một điều đầy bất ngờ, không có trong kịch bản. Hai tiếng đồng hồ và Timeless Resonance - Thanh âm bất tận, khán phòng Nhà hát lớn Hà Nội được lấp kín người.  Khán giả chăm chú lắng nghe, có không ít người còn lắc lư, phụ họa ngón tay theo tiết tấu từng bản nhạc trên sân khấu. Đêm nhạc diễn ra trong khoảng hai tiếng đồng hồ. Bao gồm cả trích đoạn ngắn chơi piano tám tay đãi thêm khán giả Việt Nam ở phần cuối, có tổng cộng 10 tiết mục. Đặng Thái Sơn đưa trò về chơi dương cầm trên quê hương Mở đầu với tiết mục piano duet (song tấu piano, hay còn gọi là piano bốn tay) đầy sống động, không kém phần khoa trương nhưng cũng nhẹ nhàng, đầy sự chờ đợi khi cuộc hành quân mở ra, Đặng Thái Sơn và học trò Sophia Liu đã mang trích đoạn trong Military March về Việt Nam. Đây là bản hành khúc nổi tiếng nhất của tác giả Franz Schubert, ra đời năm 1826. Một tác phẩm khác được Đặng Thái Sơn lựa chọn đưa vào chương trình là Variations on a Theme of Cooper's Air national in D major của F.Chopin. Ở tiết mục này, ông chơi cùng Zitong Wang - cô học trò mà Đặng Thái Sơn nhận xét là ""có ngón tay ma quái, chơi hết sức tự nhiên, dễ dàng"". Mỗi lần mệt mỏi, nghe Zitong chơi, thầy Sơn hết mệt và có năng lượng trở lại. Màn song tấu của thầy trò Đặng Thái Sơn hấp dẫn, đưa khán giả đi qua các cung bậc khác nhau; song độc tấu mới là tiết mục diễn giải cá tính của nghệ sĩ mạnh nhất. Đặng Thái Sơn đã mang ba học trò gốc Á xuất sắc của mình về chơi dương cầm trên quê hương Việt Nam: Sophia Liu (sinh năm 2008), Kaimin Chang (2001), và Zitong Wang (1999). Họ đều giành thứ hạng cao trong các cuộc concours lớn trên thế giới. Nếu Zitong Wang có ngón tay ma quái, thì Sophia được thầy Sơn gọi là ""thần đồng"", còn Kaimin Chang là người chơi những bản nhạc ""có quy mô"". Trong đêm nhạc mở màn tour lưu diễn tại Hà Nội, Sophia Liu độc tấu bản Mephisto Waltz No.1, S.514 của F.Liszt, Kaimin Chang biểu diễn Bagatelles Op.33, No.1,2 & 3 của L.V. Beethoven và Sonata No.3, Op.23 của A. Scriabin. Trong khi đó Zitong biến hóa với bản Selection from 24 Preludes, Op.28 của F. Chopin. Nghệ sĩ Đặng Thái Sơn trình diễn Barcarolle No.1, Op.26 in a minor của G.Fauré, Waltz No.2, Op.69 in B minor của F.Chopin và Golliwog's Cakewalk from Children's corner, L.113 của C.Debussy. Một số hình ảnh đêm Timeless Resonance - Thanh âm bất tận:",03/06/2024 12:49 GMT+7,https://tuoitre.vn/khan-gia-vo-tay-khong-ngot-thay-tro-dang-thai-son-dai-them-ban-piano-tam-tay-20240603103035089.htm,"Đêm Timeless Resonance - Thanh âm bất tận ở Hà Nội, nghệ sĩ ra chào tạm biệt khán giả, khán giả vỗ tay không ngớt. Xúc động, bốn thầy trò Đặng Thái Sơn chơi thêm một bản piano tám tay để cảm ơn."
Phụ nữ tuổi 30 có gì hấp dẫn?,"Thực tế, không có nhóm tuổi hay giới tính nào có thể thống trị hoàn toàn thị trường nội dung truyền hình, nhưng phụ nữ độ tuổi 30 đang nổi lên là đối tượng tiêu dùng chính cho truyền hình hay nền tảng nội dung phát trực tuyến OTT.  Họ dần trở thành thước đo thành công cho truyền hình hay OTT, theo báo Hankook Ilbo. Phụ nữ tuổi 30 năng động và thích sự đa dạng Phụ nữ tuổi 30 bước vào giai đoạn trưởng thành, chín chắn sau một khoảng thời gian khá dài trải nghiệm cuộc sống. Theo thống kê ở Hàn Quốc, nhóm tuổi này đăng ký trung bình 2,5 các loại dịch vụ phát trực tuyến, cao nhất trong các nhóm tuổi, tạo thành nhóm người dùng lớn nhất của mỗi nền tảng phát trực tuyến. Mặt khác, phụ nữ ở độ tuổi 30 thích nhiều loại nội dung, từ phim truyền hình lãng mạn đến chương trình giải trí. Họ cũng được đánh giá cao nhờ thói quen xem các chương trình năng động, tích cực tìm kiếm nội dung mà họ quan tâm trên nhiều nền tảng khác nhau. Ngoài ra, họ còn giúp thu hút người xem mới bằng cách chia sẻ nội dung yêu thích lên mạng xã hội theo nhiều cách khác nhau. Thu hút sự chú ý của nhóm nữ 30 tuổi kéo theo thu hút cả người xem trẻ tuổi và lớn tuổi. Công cụ dự đoán tin cậy Nắm bắt đối tượng khán giả quan trọng này, các đơn vị OTT đã tung ra nhiều nội dung phục vụ họ. The Glory - bộ phim kể về cô gái tuổi 30 Moon Dong Eun từng bị bắt nạt học đường lên kế hoạch trả thù những người bắt nạt mình phát trên Netflix - là ví dụ điển hình cho bộ phim thu hút đông đảo khán giả nữ ở độ tuổi 30 thành công. ENA - kênh truyền hình trả tiền của Hàn Quốc - gây sự chú ý với chương trình hẹn hò I am solo, thu hút phụ nữ ở độ tuổi 30. Hai nền tảng phát nội dung trực tuyến là Wavve và Coupang Play phát hành bộ phim Weak hero class 1 và Anna cũng từng thu hút đông khán giả nữ tuổi 30. Chính sự tương tác tích cực và nhạy cảm với nội dung khiến phụ nữ tuổi 30 trở thành công cụ dự đoán tin cậy về nội dung. Kênh tvN tăng tỉ lệ phụ nữ trong độ tuổi 30 lên 70% trong nhóm đánh giá phim truyền hình của nội bộ. Điều này phản ánh trọng tâm chiến lược của kênh đối với nhóm tuổi này.",03/06/2024 11:15 GMT+7,https://tuoitre.vn/phu-nu-tuoi-30-co-gi-hap-dan-20240602180331442.htm,"Nhiệm vụ của các kênh truyền hình, nền tảng OTT của Hàn Quốc là thu hút đối tượng khán giả nữ trong độ tuổi 30. Vì sao họ lại được truyền hình chú ý trong giai đoạn này?"
BTS công bố chuỗi sự kiện Festa kỷ niệm 11 năm thành lập,"Sự kiện này dự kiến bắt đầu vào ngày 13-6 tại khu liên hợp thể thao Seoul (Seoul Sports Complex) ở thủ đô của Hàn Quốc. Festa là một dịp quan trọng trong năm của BTS, nơi nhóm nhạc đình đám này gặp gỡ và gửi lời cảm ơn tới người hâm mộ trung thành của mình. Năm nay, Festa sẽ có sự xuất hiện của thành viên Jin, đánh dấu hoạt động chính thức đầu tiên của nam ca sĩ sau khi anh hoàn thành nghĩa vụ quân sự. Theo kế hoạch, Jin sẽ giao lưu cùng 1.000 người hâm mộ may mắn tại Seoul Sports Complex. Đồng thời, anh cũng sẽ truyền đạt một thông điệp đặc biệt cho ARMY - tên gọi của cộng đồng người hâm mộ nhóm nhạc BTS. Thông điệp này sẽ được truyền trực tiếp (livestream) đến những người đăng ký membership (thẻ thành viên) trên nền tảng Weverse. Ngoài sự kiện chính với Jin, Festa năm nay cũng sẽ mang đến nhiều hoạt động và trải nghiệm thú vị cho người hâm mộ. Một trong số đó là việc phát hành một cuốn nhật ký vẽ tranh đặc biệt để ghi nhận và kỷ niệm 11 năm hoạt động của BTS. Trước đó, để kỷ niệm ngày quan trọng này, BTS đã chia sẻ những bức ảnh chưa từng được công bố, phát trực tiếp các buổi hòa nhạc đã diễn ra trước đây và đăng tải những bài viết viết tay từ mỗi thành viên của nhóm. Các thành viên còn lại của BTS đang thực hiện nghĩa vụ quân sự tại Hàn Quốc. Tuy nhiên, nhóm dự định tái hợp và tiếp tục hoạt động chung vào năm 2025.",03/06/2024 11:05 GMT+7,https://tuoitre.vn/bts-cong-bo-chuoi-su-kien-festa-ky-niem-11-nam-thanh-lap-20240603104217168.htm,"Nhóm nhạc BTS vừa công bố kế hoạch tổ chức chuỗi sự kiện Festa 2024, nhằm kỷ niệm 11 năm thành lập."
"Hãy giữ gìn sự trong sáng cho Nobita, Shizuka của manga Doraemon","Thời gian gần đây, do sự nổi tiếng của phim Doraemon: Nobita và bản giao hưởng Địa Cầu, trên nền tảng mạng xã hội TikTok, Facebook bỗng nổi lên nhiều bài viết nhạy cảm có các nhân vật trong Doraemon. Trong đó có cả nhiều video, tranh, ảnh mang nội dung 18+ xuyên tạc tác phẩm trong sáng dành cho trẻ thơ này. Nhân vật trẻ em là đối tượng của tình dục hóa Cụ thể, một số tài khoản trên TikTok và hội nhóm trên Facebook bị phản ánh là đăng tải hình ảnh cậu bé Nobita ghép đôi cùng Dekisugi hoặc Luka (một nhân vật trong phim Doraemon: Nobita và Mặt trăng phiêu lưu ký), với nhiều cách thể hiện tình cảm mang tính người lớn. Văn hóa ghép đôi các nhân vật truyện tranh, anime đã tồn tại từ lâu trong cộng đồng những người yêu thích văn hóa Nhật Bản. Tuy nhiên, nhân vật của nhóm bạn Doraemon nói chung và Nobita nói riêng chỉ mới ở lứa tuổi tiểu học (10 tuổi). Vậy nên việc chia sẻ nội dung như trên là góp phần tình dục hóa hình ảnh trẻ em trên mạng xã hội. Đáng chú ý hơn, những video, tranh ảnh 18+ của Doraemon thu hút hàng trăm nghìn lượt xem và tương tác. Dưới phần bình luận là những ngôn từ phản cảm, được viết bởi những em nhỏ mới chỉ học cấp 2, cấp 3. Các em bình luận về tình yêu, tình dục đồng tính giữa nhân vật một cách bỗ bã, tùy tiện, thậm chí đề cập đến hành động hiếp dâm. Bài đăng phản ánh tình trạng này trên Facebook cũng thu hút hàng nghìn lượt tương tác, đa số lên án việc truyền bá những hình ảnh đồi trụy của các nhân vật trong Doraemon. ""Việc tình dục hóa nhân vật trong văn hóa phẩm cho trẻ em sẽ khiến khán giả có tư tưởng lệch lạc từ nhỏ. Hình ảnh lệch lạc đó sẽ hằn sâu vào trong tiềm thức các em... Việc tiếp cận những nội dung về tình dục trên mạng xã hội với đủ thể loại, lứa tuổi người dùng dễ dàng như vậy thì mình nghĩ việc giáo dục giới tính cần được coi trọng hơn"" - chủ bài viết nhận định. Trong đó, có một người dùng cũng phản ánh rằng thuật toán gợi ý video TikTok thường vô tình hiện lên nội dung 18+ dù từ khóa chỉ là ""Doraemon"" hoặc ""Năm anh em siêu nhân"", cảnh tỉnh phụ huynh nên cẩn thận khi cho con sử dụng mạng xã hội, tránh để các em tiếp xúc nội dung liên quan đến tình dục quá sớm.",03/06/2024 09:25 GMT+7,https://tuoitre.vn/hay-giu-gin-su-trong-sang-cho-nobita-shizuka-cua-manga-doraemon-20240603072906348.htm,"Hình ảnh các nhân vật trong Doraemon, đặc biệt là Nobita, bị tình dục hóa đang xuất hiện tràn lan trên TikTok, Facebook, những người chia sẻ nội dung này vẫn còn đang ngồi trên ghế nhà trường."
