Title,Content,Date,Url,Summary
Nữ sinh tại TP.HCM phải nằm để thi lớp 10 do tai nạn,"Nữ sinh vượt qua biến cố đi thi lớp 10 Sau biến cố, nữ sinh Nguyễn Thị Yến Nhi lấy lại tinh thần để tiếp tục ôn luyện thi vào lớp 10. Nữ sinh cho biết mình nhờ bạn bè chỉ bài, những phần kiến thức khó sẽ nhờ thầy cô hướng dẫn. ""Em quyết tâm nỗ lực hết mình, em ước mơ được làm bác sĩ. Em muốn học thật giỏi để sau này có công việc ổn định, phụ giúp mẹ và chăm lo cho em trai"", Nhi nói. Những tháng qua Nhi dành toàn bộ thời gian để ôn thi, bạn thường thức đến 1h sáng và dậy vào 5h để học bài và ôn bài. Sáng nay 6-6, Yến Nhi sẽ thi môn ngữ văn tại điểm Trường THCS Phan Bội Châu, quận 12. Hiện dù có chút lo lắng nhưng có mẹ cùng đồng hành, Yến Nhi cũng đỡ hồi hộp. Tạo điều kiện cho thí sinh Thấy con ham học, bà Nguyễn Thị Ánh Trang (quận 12) bỏ ngang công việc buôn bán, cùng con trai ở nhà chăm sóc cho Yến Nhi. Bà Nguyễn Thị Ánh Trang cho biết tình hình sức khỏe của Nhi hiện giờ đã ổn, cần phải nằm để nhanh lành vết thương. ""Con nằm ở nhà cố gắng học, các cô cũng xuống hỗ trợ, nhà trường cũng tạo điều kiện cho con. Các năm liền con đều là học sinh giỏi. Ở nhà thì mẹ cho bé ổn định tâm lý và chăm lo sức khỏe cho con. Con mong muốn thi vào Trường THPT Nguyễn Hữu Cầu, Trường THPT Bà Điểm và Trường THPT Hồ Thị Bi (huyện Hóc Môn). Tôi sẽ thuê xe cứu thương đưa con đến trường để tham gia kỳ thi"" - bà Trang chia sẻ. Ông Hồ Ngọc Đăng Khoa - trưởng điểm thi Trường THCS Phan Bội Châu, quận 12 - cho biết điểm thi có thí sinh đặc biệt bị chấn thương cột sống nên phải nằm để làm bài. ""Điểm thi bố trí phòng dự trữ ở tầng trệt để hỗ trợ thí sinh thuận tiện trong việc vào phòng thi, bố trí 2 cán bộ coi thi và 1 cán bộ giám sát. Trường cũng có cán bộ y tế và xe cứu thương chờ sẵn. Trường cũng có bố trí khu vực riêng để giữ đồ đạc cho thí sinh. Cán bộ coi thi sẽ có nhắc nhở để các em biết quy định, theo đó đến đúng giờ thi"" - ông Khoa nói. ",06/06/2024 07:01 GMT+7,https://tuoitre.vn/nu-sinh-tai-tp-hcm-phai-nam-de-thi-lop-10-do-tai-nan-20240605221215482.htm,"Do một tai nạn bất ngờ cách đây 3 tháng, nữ sinh Nguyễn Thị Yến Nhi (Trường THCS Nguyễn An Ninh, quận 12) bị gãy đốt sống lưng và ngực, dẫn đến việc phải nằm một chỗ."
Học ngành xu thế cùng cơ hội thực tập và làm việc tại Trung Quốc,"Trường Đại học Kinh tế - Tài chính TP.HCM (UEF) những năm gần đây từ mối quan hệ hợp tác chiến lược mạnh mẽ với hơn 1.000 doanh nghiệp trong và ngoài nước đã mở ra cho sinh viên các ngành ngôn ngữ, trong đó có ngôn ngữ Trung Quốc thị trường việc làm đa dạng cả trong và ngoài nước. Đây dự đoán sẽ là xu hướng nghề nghiệp tương lai mà sinh viên ngành này sẽ được trải nghiệm và nắm bắt. Học ngôn ngữ, học cả văn hóa, lịch sử và thực chiến Bên cạnh kiến thức chuyên môn, sinh viên ngành ngôn ngữ Trung Quốc tại UEF được tạo điều kiện tìm hiểu văn hóa, lịch sử và bổ sung kinh nghiệm từ các hoạt động ngoại khóa. Trong đó, chương trình mang đậm màu sắc văn hóa bản địa như Hội thi văn nghệ Việt - Trung được tổ chức thường niên, hay chương trình du học online ‘Trải nghiệm văn hóa Trung Quốc’ giúp các bạn mở rộng góc nhìn quốc tế, tạo môi trường ứng dụng kiến thức ngôn ngữ, giao lưu và kết nối. Ngoài ra, các workshop, talkshow,… truyền động lực và cảm hứng học ngôn ngữ, định hướng nghề nghiệp cũng được trường tăng cường. Lắng nghe chia sẻ từ chuyên gia, sinh viên xác định rõ ràng hơn về mục tiêu học ngành ngôn ngữ và vạch ra lộ trình học tập phù hợp. Với ngành ngôn ngữ Trung Quốc, sinh viên cũng thường xuyên được tư vấn về các chứng chỉ học thuật cần thiết và cách thực hiện bài thi hiệu quả. Kiến thức và kỹ năng được trang bị cho sinh viên luôn được tạo điều kiện để vận dụng, thi đua và trau dồi toàn diện hơn. Cuộc thi hùng biện là môi trường bổ ích giúp các bạn phát triển. Việc kết hợp kiến thức ngôn ngữ và giá trị văn hóa tại các sân chơi học thuật góp phần thúc đẩy khả năng thực chiến và năng lực tư duy. Sinh viên ngành ngôn ngữ Trung Quốc của Trường nhiều năm liền đạt thành tích cao tại cuộc thi Hùng biện tiếng Trung toàn quốc hai năm liên tiếp (2022 và 2023). ‘Nâng trình’ kỹ năng trong môi trường quốc tế Việc học ngôn ngữ Trung Quốc tại UEF cũng như các ngành ngôn ngữ khác, sinh viên liên tục tham gia môi trường thực chiến và giao tiếp cùng người bản địa. Sinh viên ngoài việc được học với giảng viên quốc tế còn có cơ hội ‘xuất ngoại’, tiếp xúc cuộc sống và văn hóa bản xứ. Sinh viên có cơ hội nâng cao kỹ năng khi tham gia trao đổi và thực tập quốc tế tại Trung Quốc. Quá trình làm việc và học tập trong môi trường quốc tế có thể nói giúp sinh viên nâng cao về mặt kiến thức ngôn ngữ và văn hóa. Kỹ năng của các bạn cải thiện rõ rệt sau khoảng thời gian thực chiến. Tham gia chương trình thực tập tại Trung Quốc, bạn Lê Đặng Phương Nghi cho biết: ‘Trước khi tham gia chương trình thực tập quốc tế, UEF đã trang bị cho em nhiều kỹ năng cần thiết và những lưu ý khi học tập, làm việc ở nước ngoài. Bên cạnh kiến thức chuyên môn về ngôn ngữ Trung Quốc, văn hóa kinh doanh và đời sống của người dân tại đất nước tỷ dân này, Nhà trường còn trang bị cho sinh viên chúng em kiến thức kỹ năng mềm cần thiết giúp em có đủ tự tin để bước ra ngôi trường quốc tế học tập, làm việc’. Học bổng 35% toàn khóa, kết nối doanh nghiệp quốc tế Xác định là ngành ngôn ngữ mang tính xu hướng, hội nhập cao, thí sinh chọn xét tuyển ngành ngôn ngữ Trung Quốc, khi trúng tuyển được hưởng chính sách học bổng 35% toàn khóa học cùng nhiều chính sách học bổng khác từ các trường đối tác của Trường từ Trung Quốc. Ngoài chính sách học bổng tiếp thêm động lực học ngôn ngữ trong môi trường song ngữ, quốc tế, sinh viên thường xuyên được học tập, tham quan, tìm hiểu các tập đoàn, công ty của Trung Quốc có chi nhánh tại Việt Nam, được tiếp cận môi trường thực tế, hiểu biết vị trí công việc rõ ràng để có bước chuẩn bị nghề nghiệp cho tương lai. Trường còn mở rộng cơ hội học tập song bằng, song ngành đối với ngành học này bằng nhiều hình thức như học hai ngành song song theo quy định, chuyển tiếp học tập chương trình quốc tế, chuyển tiếp học tập tại các trường đối tác của Trường. Trường hiện nhận hồ sơ xét tuyển học bạ ngành ngôn ngữ Trung Quốc với mức điểm trung bình 3 học kỳ hoặc tổng điểm trung bình lớp 12 của tổ hợp ba môn từ 18 điểm trở lên.",05/06/2024 15:00 GMT+7,https://tuoitre.vn/hoc-nganh-xu-the-cung-co-hoi-thuc-tap-va-lam-viec-tai-trung-quoc-20240605112747616.htm,"Lợi thế khi thí sinh chọn học các ngành ngôn ngữ như Nhật, Hàn, Trung là tốt nghiệp có nhiều cơ hội nắm bắt việc làm."
HUTECH nhận hồ sơ xét tuyển học bạ: Từ 18-24 điểm," Điểm xét tuyển vừa tầm Trong đợt nhận hồ sơ xét tuyển học bạ đến 30-6, Trường tiếp tục nhận hồ sơ theo cả hai hình thức gồm xét tuyển học bạ ba học kỳ (điểm xét tuyển tính bằng tổng điểm trung bình học kỳ 1, học kỳ 2 lớp 11 và học kỳ 1 lớp 12) và xét tuyển học bạ lớp 12 theo tổ hợp ba môn. Thí sinh có thể nộp hồ sơ xét học bạ để có cơ hội trúng tuyển vào 63 ngành đào tạo tại Trường, với điểm nhận hồ sơ mỗi ngành dao động từ 18 - 24 điểm. Trong đó, điểm nhận hồ sơ xét tuyển cao nhất là 24 điểm đối với ngành Dược, 19.5 điểm đối với ngành Điều dưỡng, Kỹ thuật xét nghiệm y học.  Tất cả các ngành còn lại có điểm nhận hồ sơ là 18 điểm. Ngoài điều kiện về điểm, thí sinh xét tuyển ngành Dược học cần đạt học lực Giỏi ở lớp 12 hoặc điểm xét tốt nghiệp THPT từ 8.0 điểm trở lên; thí sinh xét tuyển ngành Điều dưỡng và Kỹ thuật xét nghiệm y học cần đạt học lực Khá trở lên ở lớp 12 hoặc điểm xét tốt nghiệp THPT từ 6.5 điểm trở lên. Thực tế cho thấy, trong giai đoạn ‘nước rút’ hiện tại, với những thí sinh có nguyện vọng vào các ngành đang cạnh tranh cao như Truyền thông đa phương tiện, Marketing, Digital Marketing, Quan hệ công chúng, Thiết kế đồ họa, Công nghệ thông tin, Công nghệ kỹ thuật ô tô, Quản trị kinh doanh,… thì việc xét tuyển học bạ sẽ mang đến loạt lợi thế nổi trội như chủ động về điểm số, giảm áp lực thi cử, ‘chắc suất’ trúng tuyển vào đại học đúng ngành mơ ước mà không quá phụ thuộc vào một kỳ thi duy nhất. Nhiều thí sinh có xu hướng tập trung cho các môn học thế mạnh để thuận tiện ôn thi tốt nghiệp THPT nên việc xét tuyển học bạ lớp 12 theo tổ hợp 03 môn giúp các bạn tận dụng tối đa thế mạnh của mình. Trong khi đó, thí sinh có học lực đều ở các môn hay muốn dành nửa cuối năm lớp 12 để ôn thi tốt nghiệp có thể chọn xét tuyển học bạ 03 kỳ, hoặc kết hợp cả hai phương thức trên cùng một phiếu đăng ký xét tuyển để gia tăng cơ hội cho bản thân. Nắm trong tay học bổng 50% học phí khi đăng ký nguyện vọng 1 Với chính sách học bổng đa dạng trong mùa tuyển sinh 2024, Trường được đông đảo thí sinh quan tâm chốt chọn đăng ký nguyện vọng 1 để nhận những suất học bổng giá trị.  Điểm nhấn trong chính sách năm nay là học bổng ‘Tự hào sinh viên HUTECH’ trị giá 50% học phí học kỳ đầu tiên cho tất cả thí sinh đăng ký xét tuyển theo thời gian quy định và trúng tuyển vào trường bằng nguyện vọng 1; trị giá 25% học phí học kỳ đầu tiên cho tất cả thí sinh đăng ký xét tuyển theo thời gian quy định và trúng tuyển vào bằng nguyện vọng 2, 3. Song song đó, Trường còn triển khai nhiều chính sách học bổng đa dạng khác như Học bổng Tài năng, Học bổng Tiếp sức, Học bổng Doanh nghiệp, Học bổng Giáo dục, Học bổng Gia đình với nhiều trị giá hấp dẫn từ 25% - 50% - 75% - 100% học phí toàn khóa học. Các chính sách học bổng này đều thực hiện xét chọn với tất cả thí sinh đạt tiêu chí, không phân biệt phương thức xét tuyển. Học bổng áp dụng ở cả bốn phương thức xét tuyển tại HUTECH gồm xét tuyển kết quả kỳ thi tốt nghiệp THPT 2024, xét tuyển kết quả kỳ thi Đánh giá năng lực 2024 của ĐHQG TP.HCM, xét tuyển học bạ theo tổng điểm trung bình ba môn năm lớp 12 và xét tuyển học bạ theo tổng điểm trung bình ba học kỳ. Trong đó, hình thức xét tuyển học bạ đang ‘hút’ thí sinh tham gia xét tuyển. Thí sinh đăng ký xét tuyển học bạ đợt 30-6 vào trường có thể chọn một trong ba hình thức: nộp hồ sơ đăng ký trực tiếp tại Trường, gửi hồ sơ qua đường bưu điện, đăng ký trực tuyến tại website hutech.edu.vn hoặc zalo Đại học HUTECH. Được biết đến là ‘đại học Gen Z’, Trường mang đến cho thế hệ trẻ môi trường phát triển toàn diện từ chuyên môn, kỹ năng mềm đến năng khiếu cá nhân - thêm tự tin, bản lĩnh để vươn cao trong thị trường lao động thời hội nhập.",05/06/2024 15:00 GMT+7,https://tuoitre.vn/hutech-nhan-ho-so-xet-tuyen-hoc-ba-tu-18-24-diem-20240605111056531.htm,"Chỉ còn hơn 3 tuần nữa, kỳ thi tốt nghiệp THPT 2024 sẽ chính thức diễn ra. Trong giai đoạn ‘nước rút’, nhiều thí sinh đã chọn phương thức xét tuyển học bạ.Trường Đại học Công nghệ TPHCM (HUTECH) đang nhận hồ sơ đến 30-6."
Xếp hạng nhà khoa học: Thói hư danh làm mờ mắt,"Sau khi Tuổi Trẻ đăng bài ""Bi hài xếp hạng nhà khoa học"", qua ý kiến của các chuyên gia cho thấy những thông tin từ bài báo ""bóc phốt"" ra những sai lệch trong việc xếp hạng nhà khoa học, một lần nữa khiến nhiều người trong giới học thuật nước ta được dịp ""tỉnh cơn say"". Tổ chức xếp hạng có địa chỉ website research.com là một tổ chức thương mại bán dịch vụ tư vấn nghiên cứu cho các trường đại học, chính phủ và các tổ chức săn đầu người. Mục tiêu của tổ chức này rất đáng trân trọng nếu các hoạt động nghiên cứu và công bố đảm bảo độ chính xác tin cậy. Rất tiếc là tổ chức này không làm được như vậy. Trong thời đại số ngày nay, đặc biệt là việc truyền bá thông tin sai lệch và thói hư danh trong lĩnh vực nghiên cứu đã làm mục tiêu này đi quá xa về mức độ liêm chính và tạo nên những hệ quả xấu trong giới học thuật. Một ví dụ điển hình về việc này là hoạt động của trang web Research.com, nơi các thông tin phóng đại liên quan các nhà khoa học Việt Nam và các trường đại học bị công bố. Research.com đăng thông tin có nhà khoa học ở Việt Nam đứng thứ hai thế giới về lĩnh vực y khoa! Dư luận nghi ngờ về tính liêm chính khi tác giả này có năng suất nghiên cứu cực khủng: chỉ hai năm 2019 và 2020 nhà khoa học này đăng mỗi năm gần 100 bài! Thông tin sai lệch trong nghiên cứu có thể gây ra những hậu quả nghiêm trọng. Trường hợp của Anand Nayyar và Reza Kolahchi là minh chứng rõ ràng. Cả hai nhà khoa học này đã bị cáo buộc lũng đoạn quy trình bình duyệt và giả mạo bình duyệt, dẫn đến việc bị gỡ bỏ bài báo. Điều này không chỉ ảnh hưởng đến uy tín cá nhân của họ mà còn làm tổn hại đến danh tiếng của các trường đại học mà họ liên kết. Thói hư danh hão, thiếu liêm chính trong học thuật không chỉ ảnh hưởng đến cá nhân mà còn làm tổn hại đến uy tín của cả một quốc gia. Việc các nhà khoa học Việt Nam bị gán mác ""nhân tài"" một cách sai lệch không chỉ tạo ra những kỳ vọng không thực tế mà còn dẫn đến sự thất vọng khi thực tế không đáp ứng được kỳ vọng đó. Điều này phần nào làm mất đi niềm tin của công chúng vào nền khoa học và giáo dục nước nhà. Bài học cho giới học thuật cũng như các trường đại học, viện nghiên cứu của Việt Nam, nhất là các trường mượn hư danh để quảng cáo hình ảnh thu hút người học, tìm kiếm đối tác rót vốn, là rất cần minh bạch và trung thực trong thông tin công bố. Việc sử dụng thông tin sai lệch hoặc phóng đại sẽ gây ra hậu quả nghiêm trọng về uy tín và làm mất lòng tin của sinh viên, đối tác và cộng đồng. ""Tốt gỗ hơn tốt nước sơn"", trường đại học nên tập trung vào chất lượng hơn số lượng công bố. Chuyển hướng tập trung từ việc công bố số lượng lớn các bài báo sang việc nâng cao chất lượng nghiên cứu. Điều này không chỉ giúp nâng cao uy tín thực sự của trường mà còn góp phần vào sự phát triển bền vững của nền học thuật. Và cơ quan nhà nước có thẩm quyền cũng cần đi theo hướng này, coi trọng chất lượng hơn số lượng trong xây dựng chính sách và cơ chế. Ngoài ra cần có những quy trình kiểm tra và đánh giá nghiêm ngặt để đảm bảo rằng các nghiên cứu được công bố đều tuân thủ các tiêu chuẩn đạo đức và quy trình bình duyệt nghiêm ngặt giúp bảo đảm sự liêm chính và ngăn chặn việc lũng đoạn quy trình xét duyệt. Các nhà khoa học và trường đại học cần phải thận trọng hơn trong việc công bố nghiên cứu và nâng cao nhận thức về việc đánh giá chất lượng nghiên cứu. Khi đó nền học thuật của chúng ta mới có thể phát triển bền vững và đáng tin cậy. Việc xây dựng uy tín không thể dựa trên những thành tích giả tạo mà cần phải được xây dựng từ sự nghiêm túc, minh bạch và trách nhiệm trong nghiên cứu và giảng dạy. Chỉ khi các trường đại học nhận ra và thực hiện được điều này, nền giáo dục Việt Nam mới thực sự vững mạnh và đáng tin cậy. Đừng để sự thiếu liêm chính trong nghiên cứu và công bố phát triển như cỏ dại trên nền tảng văn hóa ""tự sướng"", nhắm mắt khen lẫn nhau mà ảnh hưởng đến danh dự, uy tín và sự phát triển bền vững của khoa học nước nhà.",05/06/2024 13:35 GMT+7,https://tuoitre.vn/xep-hang-nha-khoa-hoc-thoi-hu-danh-lam-mo-mat-20240605085105776.htm,"Đừng để sự thiếu liêm chính trong nghiên cứu và công bố phát triển như cỏ dại trên nền tảng văn hóa ""tự sướng"", nhắm mắt khen lẫn nhau mà ảnh hưởng đến danh dự, uy tín và sự phát triển bền vững của khoa học nước nhà."
Người phụ nữ lấy bằng đại học dược ở tuổi 65: Chưa nghỉ học dù chỉ 1 giờ,"Bà Nguyễn Ngọc Trinh (sinh năm 1959, TP Thủ Đức, TP.HCM) chọn học chương trình đại học liên thông tại khoa dược Trường đại học Nguyễn Tất Thành khi đã ngoài 60 tuổi. Cần mẫn học tập sau 4 năm, trong đó có thời gian khó khăn nhất của dịch COVID-19, bà đã hoàn tất chương trình và nhận bằng tốt nghiệp loại khá vào cuối tháng 5-2024. Hoàn thành tâm nguyện được đi học đại học Bà Trinh sinh ra trong gia đình có đông anh chị em. Bà không lập gia đình mà toàn tâm toàn ý chăm lo cho cha mẹ và người thân trong nhà. Đến khi ba và mẹ mất, bà Trinh quyết định theo đuổi ước mong được học. Ban đầu bà chọn học tại Trường cao đẳng Sài Gòn Gia Định, sau đó liên thông lên đại học. Bà cho biết rất vui mừng và xúc động vì đã hoàn thành chương trình học, chinh phục được tấm bằng dược sĩ đại học là tâm nguyện của cuộc đời. ""Tôi cảm thấy may mắn khi được học chung với mọi người, bạn bè trong lớp hết lòng giúp đỡ động viên để tôi vượt qua từng môn học. Đậu được môn tôi mừng lắm, cứ lần lượt từng môn hoàn thành và giờ tôi đã ra trường đúng hạn"" - bà Trinh nói. Chia sẻ về cách học tập hiệu quả, bà Nguyễn Ngọc Trinh cho biết bà học theo phương pháp ""miệng đọc tay viết"". ""Để dễ nhớ bài thì tôi vừa đọc trong đầu, vừa viết tay ra giấy. Do tôi không lập gia đình nên đầu óc thoải mái, dường như toàn bộ thời gian tôi đều dành cho việc học. Từ lúc đi học trở lại, tôi chưa nghỉ dù chỉ một giờ. Thấy tôi lớn tuổi mà còn đi học, nhiều người đã hỏi thăm, động viên. Có những bạn trẻ từng rất nản nhưng vì thấy được tinh thần ham học của tôi mà cũng quyết tâm theo"" - bà Trinh bộc bạch. Tấm gương cho người trẻ Bà Nguyễn Ngọc Trinh cho hay: ""Quá trình học tập tại trường giúp tôi nâng cao kiến thức, cập nhật các kỹ năng tự học, tự chủ động tìm kiếm nguồn kiến thức, tìm kiếm các tài liệu. Ngoài ra, còn rèn luyện thêm những kỹ năng mềm khác như quản lý thời gian, giải quyết vấn đề, hiểu hơn về chuẩn mực trong giao tiếp với khách hàng và bệnh nhân… "". ""Với tôi, học là một chặng đường dài, hy vọng các bạn trẻ sẽ luôn có tinh thần học tập để nâng cao kiến thức cho bản thân"", bà chia sẻ. Theo thầy Võ Thế Anh Tài - giảng viên khoa dược Trường đại học Nguyễn Tất Thành, bà Trinh là học viên cao tuổi nhưng rất quyết tâm. ""Tuổi của bà Trinh đáng ra phải nghỉ hưu nhưng bà lại đăng ký học đại học. Tôi rất ấn tượng về bà ở thái độ, dù lớn tuổi nhưng luôn tôn trọng giảng viên, lúc học có vấn đề gì không hiểu bà sẽ giơ tay đặt câu hỏi ngay. Hình ảnh người học có mái tóc bạc trắng, chăm chú ghi bài, nét chữ của bà rất đẹp và rõ ràng làm tôi nhớ mãi. Ở lớp, nếu có người học lớn tuổi, phụ nữ có em bé thì giảng viên luôn chú tâm hỏi thăm, thường xuyên giao tiếp bằng mắt để người học không bị mất tập trung. Các bạn ở lớp cũng hỗ trợ bà sử dụng máy tính, hướng dẫn giải hệ phương trình"" - thầy Anh Tài nói. Thầy Anh Tài cũng nhận định bà có tinh thần học tập tốt, không chỉ học cho mình mà còn làm gương cho các cháu, truyền cảm hứng cho người trẻ. Chia sẻ về định hướng công việc trong tương lai, bà Trinh cho biết bà đang làm việc tại một nhà thuốc tư nhân và bà mong muốn có thể tiếp tục công việc này. Dù đã ở độ tuổi U70 nhưng bà tâm niệm phải cống hiến với công việc để trở nên có ích cho xã hội. ",05/06/2024 12:48 GMT+7,https://tuoitre.vn/nguoi-phu-nu-lay-bang-dai-hoc-duoc-o-tuoi-65-chua-nghi-hoc-du-chi-1-gio-20240605094525901.htm,"Đó là bà Nguyễn Ngọc Trinh, ngụ TP Thủ Đức, TP.HCM. 4 năm học đại học, hễ có gì không hiểu là bà giơ tay hỏi liền."
