Title,Content,Date,Url,Summary
"Tin tức giải trí 4-6: Areum của T-ara bị truy tố vì lạm dụng con trai, Rose BlackPink gầy trơ xương","Cựu thành viên T-ara bị truy tố vì lạm dụng con trai Theo trang tin Dispatch ngày 3-6, Areum, cựu thành viên T-ara, cùng với mẹ đã bị truy tố vì tội lạm dụng, bắt cóc trẻ em. Nạn nhân của Areum và mẹ là hai người con trai của cô. Cụ thể, qua điều tra của cảnh sát Hàn Quốc, Areum có thể đã xúi giục những người con của mình tố cáo cha chúng - doanh nhân Kim Yong Gul - bạo hành. Areum đã ghi âm lời tố cáo của con trai cả và đăng lên mạng, đồng thời gửi đơn khiếu nại chồng cũ lạm dụng trẻ em. Tuy nhiên Văn phòng Công tố quận trung tâm Seoul phán quyết không đủ bằng chứng để chứng minh cáo buộc Kim Yong Gul lạm dụng con mình. Ngược lại, Areum lại bị truy tố vì tội danh tương tự, nàng cựu idol cũng bị cấm tiếp cận con trong quá trình điều tra từ nay đến 21-7. Trước đó, Areum từng cố tự tử sau khi ly hôn Kim Yong Gul, nhiều lần tố cáo chồng bạo hành và tuyên bố đã thu thập nhiều bằng chứng. Bạn trai cũ Seo Dong Hoon cũng tiết lộ với Dispatch rằng vụ lạm dụng trẻ em là do chính Areum dàn dựng để đổ tội cho chồng cũ. H'Hen Niê trồng 1ha rừng ở đồi cát ven biển Tiếp nối hành trình trồng rừng, hoa hậu H'Hen Niê vừa có chuyến trồng rừng tại Khu bảo tồn thiên nhiên Tà Kóu (tỉnh Bình Thuận). Đây là lần đầu H'Hen Niê trồng cây trên đồi đất cát, cũng là chuyến đi trồng rừng thứ hai trong năm 2024. Cô cho biết Khu bảo tồn thiên nhiên Tà Kóu có địa hình đặc biệt, khu vực rừng ven biển bị suy thoái. Việc trồng rừng nơi đây giúp phủ xanh đất cát trống, ngăn chặn sa mạc hóa, góp phần giảm thiểu biến đổi khí hậu. Lần này, đoàn đã trồng gần 720 cây bằng lăng và giáng hương. Như vậy, tính từ đầu năm đến nay, H'Hen Niê trồng được 2ha rừng. Tính luôn năm 2023, Hen trồng 7ha rừng. Hoa hậu H'Hen Niê cho biết sau chuyến đi trồng rừng ở Bình Thuận, cô sẽ đến Huế tham gia hoạt động đi bộ nhặt rác tại bãi biển Thuận An trong khuôn khổ chương trình ""Hue Plogging 2024"". Mùa hè đẹp nhất giống Tháng năm rực rỡ phiên bản nam Sáng 4-6, Galaxy Cinema đã tung trailer cho phim Mùa hè đẹp nhất, lấy đề tài thanh xuân, hoài cổ chiếu ngày 28-6 tới. Phim kể câu chuyện của nhóm sinh viên Đại học Tổng Hợp Sài Gòn thập niên 1990, gồm Nghĩa (Công Dương), Tuấn Anh (Trần Nghĩa), Minh (Minh Dự), Thái (Nguyễn Tụ) và Thảo Nguyên (Đỗ Khánh Vân). Theo giới thiệu của nhà sản xuất, phim là hoài niệm về thời thanh xuân của nhóm bạn thời điểm hiện tại, sau nhiều biến cố khiến nhóm bạn thân tan rã thời đại học. Trong phần bình luận của trailer, đã có những nhận định đầu tiên của khán giả về phim, có người chê tông màu phim đã bị lạm dụng quá mức trong nhiều phim Việt cũng lấy chủ đề thanh xuân như Mắt biếc, Cô Ba Sài Gòn,... Nhiều người nói phim giống Tháng năm rực rỡ về bối cảnh, nội dung, tông phim, cũng có những người yêu thích dòng phim thanh xuân vườn trường khẳng định vẫn sẽ ra rạp để tìm kiếm trải nghiệm ""chữa lành"". Lý giải sự tương đồng, có thể do đạo diễn Vũ Khắc Tuận từng đảm nhiệm vị trí dựng phim trong Tháng năm rực rỡ nên anh quyết định đi những bước đi an toàn cho bộ phim đầu tiên của mình, với hy vọng lặp lại thành công của Tháng năm rực rỡ. 2 ngày 1 đêm mùa 3 lên sóng từ ngày 16-6 Nhà sản xuất 2 ngày 1 đêm chính thức công bố ngày phát sóng tập đầu tiên mùa 3 là ngày 16-6 lúc 20h30 trên HTV7 và 20h40 trên YouTube. Thông tin gây chú ý, nhận đến gần ngàn ý kiến khán giả trên fanpage chương trình. Phần lớn ý kiến bày tỏ sự mong chờ có chương trình giải trí vui vẻ hấp dẫn và được xem những phong cảnh đẹp của đất nước trong dịp hè này. Mùa 3 tiếp tục quy tụ 6 thành viên cũ được yêu mến là Trường Giang, Kiều Minh Tuấn, Ngô Kiến Huy, Lê Dương Bảo Lâm, Cris Phan, HIEUTHUHAI. Bên cạnh đó là sự góp mặt của những khách mời đặc biệt, mang đến bất ngờ cho khán giả. Chủ đề chương trình năm nay có tên ""Không giới hạn"", các thành viên phải vượt qua giới hạn bản thân để chiến thắng. Ban tổ chức cũng khẳng định đưa các thành viên đến với những địa điểm du lịch mới, đẹp khắp mọi miền đất nước để khám phá những cảnh đẹp hùng vĩ, những nét văn hóa độc đáo và con người thân thiện Việt Nam. Khán giả lo lắng cho tình trạng của Rosé BlackPink Ngày 2-6, một người hâm mộ bắt gặp Rosé (thành viên BlackPink) tại một buổi ghi hình của nữ thần tượng và khoe cảnh Rosé cưng nựng chú chó của mình trên TikTok. Video thu hút 6,9 triệu lượt xem và cũng gây tranh cãi trong cộng đồng người hâm mộ K-pop. Trong đoạn video ngắn, Rosé xuất hiện với thân hình khẳng khiu, tuy biểu cảm của cô vẫn rạng rỡ nhưng nhiều người hâm mộ bày tỏ quan ngại sâu sắc cho sức khỏe của nàng idol. Nhiều người cho rằng lịch trình dày đặc sau khi kết thúc hợp đồng cá nhân với YG Entertainment là nguyên nhân khiến cân nặng của cô nàng suy giảm. Nhiều người mong thần tượng của mình quan tâm đến bản thân. Không chỉ Rosé, các thành viên còn lại của BlackPink cũng từng có dấu hiệu sức khỏe suy giảm trong quá trình tập trung cho concert Born Pink. Trước đây, Rosé luôn chọn trang phục kín đáo, rộng rãi để che đi thân hình mảnh khảnh của mình, đó là lý do những người hâm mộ cô lại bàng hoàng như vậy khi thấy tình trạng của thần tượng mình.",04/06/2024 16:17 GMT+7,https://tuoitre.vn/tin-tuc-giai-tri-4-6-areum-cua-t-ara-bi-truy-to-vi-lam-dung-con-trai-rose-blackpink-gay-tro-xuong-20240604155033968.htm,Một số tin tức nổi bật: Cựu thành viên T-ara bị truy tố vì lạm dụng con trai; H'Hen Niê trồng cả ha rừng ở đồi cát ven biển; Mùa hè đẹp nhất giống Tháng năm rực rỡ phiên bản nam; Khán giả lo lắng cho tình trạng của Rosé (BlackPink)...
Hoa hậu Nguyễn Thanh Hà mang cả tỉ đồng tiền thưởng làm dự án bảo vệ môi trường,"Nguyễn Thanh Hà - người đẹp đến từ Bến Tre - đoạt ngôi vị cao nhất cuộc thi Hoa hậu Môi trường Việt Nam mùa đầu tiên, tổ chức năm 2022. Một năm sau đó, Thanh Hà mang vinh quang về cho Việt Nam khi cô đoạt vương miện cuộc thi Hoa hậu Môi trường thế giới 2023. Cô cũng là người Việt Nam đầu tiên giành giải thưởng cao tại cuộc thi này. Nhiều dự án ""xanh"" được triển khai quy mô Trong năm 2023, hoa hậu Nguyễn Thanh Hà thực hiện ba dự án, tạo được hiệu ứng xã hội. Đó là dự án Vòng tay xanh Mekong hỗ trợ về đào tạo, cung cấp kiến thức cho phụ nữ ở Đồng bằng sông Cửu Long, thay đổi sinh kế phù hợp. Thứ hai là dự án Vòng tay khởi nghiệp, trang bị thêm kỹ năng mềm để sinh viên thích nghi với môi trường làm việc mới sau khi tốt nghiệp. Dự án thứ ba mang tên Tiếng Anh cộng đồng, tổ chức dạy tiếng Anh miễn phí cho người dân ở một số quận, huyện tại TP.HCM. Qua đây có thể giúp người dân giao tiếp, giới thiệu sản phẩm cho du khách nước ngoài. Thanh Hà cho biết sẽ mở rộng dự án này đến các tỉnh miền Tây Nam Bộ trong thời gian tới, giúp nhiều bà con làm homestay, dịch vụ du lịch với du khách nước ngoài thuận tiện hơn. Chi phí thực hiện các dự án hơn 1 tỉ đồng từ tiền thưởng đoạt giải hoa hậu.  ""Nhìn lại nhiệm kỳ Hoa hậu Môi trường thế giới 2023, tôi thực hiện được hai việc đau đáu, đó là giúp đỡ phụ nữ ở Đồng bằng sông Cửu Long trước biến đổi khí hậu và tham gia hành trình trồng 1 tỉ cây xanh ""Vì một Việt Nam xanh"". Thời gian một nhiệm kỳ khá ngắn, tôi biết mình cần cố gắng hơn, tham gia nhiều hơn, để có thể trồng thêm thật nhiều cây xanh"" - Thanh Hà chia sẻ. Thi vẽ tranh bảo vệ môi trường Hoa hậu Thanh Hà quan niệm ""sứ mệnh bảo vệ môi trường không dành cho riêng ai vì môi trường sống thuộc về tất cả mọi người"". Thanh Hà nghĩ cô cũng chỉ là một người bình thường, đang cố gắng hết sức để cải thiện môi trường sống của chính mình bằng hành động cụ thể hằng ngày. Tuy nhiên với vai trò là Hoa hậu Môi trường thế giới, Thanh Hà có ưu thế hơn, có thể xuất hiện trước nhiều người để bày tỏ những vấn đề về môi trường, đánh động sự quan tâm của nhiều người hơn. ""Tham dự vòng chung kết cuộc thi Hoa hậu Môi trường thế giới, tôi mặc bộ trang phục nói về Đồng bằng sông Cửu Long, về biến đổi khí hậu, về những bất trắc người dân gặp phải. Đó là điều Hoa hậu Môi trường thế giới cho tôi tiếng nói, để lan tỏa hành động vì thành phố, vì môi trường sống, vì không gian quanh mình"" - Thanh Hà chia sẻ. Khi được hỏi về những dự án mới trong năm 2024, Thanh Hà cho biết cô ấp ủ tổ chức cuộc thi vẽ tranh bảo vệ môi trường cho học sinh cấp 1 và cấp 2 tại TP.HCM. Cô hy vọng có thể khơi gợi ý thức bảo vệ môi trường cho các em ngay từ trên ghế nhà trường. Sau đó, các em có thể trao đổi với gia đình, người thân, cùng tạo ra thay đổi trong tương lai. ""Sắp tới tôi phát hành quyển sách đầu tay mang tên ""Hào quang trên vương miện xanh"", ghi lại hành trình bản thân học hỏi và trưởng thành khi trở thành Hoa hậu Môi trường thế giới"" - hoa hậu quê Bến Tre bộc bạch. ",04/06/2024 15:40 GMT+7,https://tuoitre.vn/hoa-hau-nguyen-thanh-ha-mang-ca-ti-dong-tien-thuong-lam-du-an-bao-ve-moi-truong-20240604142937726.htm,"Nhìn lại nhiệm kỳ Hoa hậu Môi trường thế giới 2023, Nguyễn Thanh Hà có những đóng góp tích cực qua nhiều dự án ý nghĩa, góp phần bảo vệ môi trường sống."
"Venom 3, chuyến phiêu lưu cuối của Venom trước khi về MCU","Sau hai phần phim thành công về mặt doanh thu là Venom và Venom: Let There Be Carnage, thu về cho Sony tổng cộng hơn 1,3 tỉ USD, hãng này tiếp tục công bố phần tiếp theo có tên Venom: The Last Dance trong sự kiện CinemaCon 2022 và ấn định lịch chiếu ngày 25-10 năm nay. Tài tử người Anh Tom Hardy tiếp tục vào vai Eddie Brock, vật chủ của ký sinh trùng ngoài hành tinh Venom. Chưa phải lần cuối Venom xuất hiện Theo miêu tả từ nhà sản xuất, Venom: The Last Dance bắt đầu khi Edidie và Venom bị chính phủ săn đuổi, cả hai vừa phải chạy trốn các đặc vụ của chính phủ Mỹ, vừa phải đối mặt với các cá thể Symbiotes đổ bộ xuống trái đất để tiêu diệt Venom. Nổi bật trong trailer là sự hài hước và màn phối hợp ăn ý của cặp đôi nhân vật chính, cùng với những quái vật Symbiotes khổng lồ hứa hẹn những phân cảnh hành động mãn nhãn. Thêm vào đó, chúng ta cũng đã được hé lộ kết thúc cảm động cho hành trình của Eddie và Venom. Dưới phần bình luận, khán giả kỳ vọng cả hai sẽ có cái kết viên mãn như Người Sói Logan thay vì tiếp tục bị ""vắt sữa"". Tuy là phần cuối của loạt phim, Venom sẽ sớm tái xuất trong vũ trụ điện ảnh Marvel thông qua một phần cơ thể ký sinh của Venom vô tình bị bỏ lại MCU sau phần phim Spider-Man: No Way Home. Sau Venom: The Last Dance, khán giả nhiều khả năng sẽ được thấy một Venom mới trên màn ảnh trong Spider-Man 4 - phần phim được cho là cuối cùng của Người Nhện Tom Holland trong MCU.",04/06/2024 12:03 GMT+7,https://tuoitre.vn/venom-3-chuyen-phieu-luu-cuoi-cua-venom-truoc-khi-ve-mcu-20240604114240621.htm,Sony vừa cho ra mắt trailer mới của Venom 3 với tên chính thức là Venom: The Last Dance. Đây cũng là phần cuối cùng trong loạt phim riêng về kẻ ác nhân truyền kiếp của Spider-Man.
"Inside Out 2, Bad Boys 4 và các phim đáng chú ý trong tháng 6","Thị trường rạp chiếu mùa hè ngày càng tăng nhiệt, nhất là sau chiến thắng về mặt doanh thu của Doraemon: Nobita và bản giao hưởng Địa Cầu trước các bom tấn từ Hollywood. Tháng 6 này hứa hẹn sẽ là sự vùng lên từ kinh đô điện ảnh với nhiều cái tên được khán giả đón đợi như Bad Boys 4, Inside Out 2. Đầu tháng 6 sẽ có ba bộ phim đồng loạt chiếu ngày 7-6 là bom tấn hành động Bad Boys: Ride or Die; phim giật gân Việt - Móng vuốt; và Gia tài của ngoại - bộ phim tình cảm gia đình Thái Lan sản xuất. Bad Boys: Ride or Die Trong đó, nổi bật nhất là màn tái xuất của ""cặp bài trùng"" Will Smith và Martin Lawrence trong Bad Boys: Ride or Die (Những gã trai hư: Chơi hay bị xơi). Đây là phần thứ tư trong loạt phim hài hành động đình đám Bad Boys, đánh dấu cột mốc hơn hai thập kỷ của thương hiệu này. Trong Bad Boys 4, hai chàng thanh tra phải lên đường giải oan cho đội trưởng Conrad Howard, bị ghép tội hợp tác với các băng đảng.  Phim tiếp nối ngay sau Bad Boys 3, Mike và Marcus phải tìm chân tướng của tên trùm bí ẩn (do Eric Dane thủ vai). Đây cũng là lần đầu tiên Will Smith trở lại với một bộ phim bom tấn sau cái tát lịch sử tại Oscar 2022. Móng vuốt Bộ phim Việt Nam hiếm hoi ra mắt trong tháng 6 là Móng vuốt của đạo diễn Lê Thanh Sơn, được quảng bá là bộ phim sinh tồn quái vật đầu tiên tại Việt Nam, ""nhân vật chính"" là con gấu khổng lồ được dựng từ công nghệ kỹ xảo. Câu chuyện của phim xoay quanh bảy nhân vật cắm trại trong rừng, họ bất ngờ bị tấn công bởi một con gấu khổng lồ đột biến, khiến cho từng thành viên trong đoàn bỏ mạng. Nhìn chung, phim có những yếu tố lấy cảm hứng từ các bộ phim kinh dị, giật gân Mỹ thập niên 1990 như Friday the 13th, Texas Chainsaw Massacre... khi một nhóm bạn trẻ phải đối đầu với thế lực sát nhân, quái vật trong bối cảnh biệt lập. Dàn diễn viên gồm Thảo Tâm, Tuấn Trần, Rocker Nguyễn, Naomi, Quốc Khánh, Gi A Nguyễn và Ceri Thu Hà. Inside Out 2 Những tháng hè là quãng thời gian lý tưởng cho những người yêu thích phim hoạt hình. Sau Doraemon: Nobita và bản giao hưởng Địa Cầu hay Mèo béo siêu quậy, một trong những phim hoạt hình được mong đợi nhất năm - Inside Out 2 - sẽ chiếu tại Việt Nam ngày 14-6 tới. Tiếp nối thành công của phần một, Inside Out 2 (tựa Việt: Những mảnh ghép cảm xúc 2) dẫn khán giả khám phá thế giới nội tâm của cô bé Riley giờ đây đã đến độ tuổi vị thành niên. Ngoài những cảm xúc cơ bản từ phần trước như Joy (Niềm vui), Sadness (Nỗi buồn), Anger (Sự tức giận), Fear (Sợ hãi) và Disgust (Ghê tởm), tâm trí của cô bé Riley giờ đây đón những thành viên mới như Anxiety (Tự ti) cùng nhiều cảm xúc khác trên chặng đường lớn lên và trưởng thành của mình. Một số phim kinh dị nổi bật Tất nhiên, khán giả yêu phim kinh dị cũng sẽ có dịp ra rạp trong tháng này, với hai phim kinh dị được đầu tư hàng trăm triệu USD là The Watchers và A Quiet Place: Day One. Trong đó, The Watchers (tựa Việt: Những kẻ theo dõi) theo chân Mina, một họa sĩ 28 tuổi bị lạc trong khu rừng hoang sơ ở phía tây Ireland. Khi Mina tìm được nơi trú ẩn, cô không hề biết rằng mình đã bị mắc kẹt cùng ba người lạ khác, mà tất cả đều đang bị theo dõi và săn lùng bởi những sinh vật bí ẩn mỗi đêm. Còn A Quiet Place: Day One (tựa Việt: Vùng đất câm lặng: Ngày một) là ngoại truyện của thương hiệu A Quiet Place, kể về những ngày đầu tiên sinh vật ngoài hành tinh xâm chiếm trái đất và con người đã thất thủ trước chúng như thế nào. ",04/06/2024 07:37 GMT+7,https://tuoitre.vn/inside-out-2-bad-boys-4-va-cac-phim-dang-chu-y-trong-thang-sau-20240603124646649.htm,"Tháng 6 là thời điểm các nhà phát hành phim bắt đầu bứt tốc để đón đầu thị trường mùa hè béo bở, với nhiều bom tấn ra mắt như Inside Out 2, Bad Boys 4 hay Móng vuốt."
"Hoa hậu, á hậu không phải là những bình hoa di động","Chiều 3-6, tại TP.HCM, ban tổ chức Miss Grand Vietnam 2024 tổ chức họp báo, tổng đạo diễn Miss Grand Vietnam 2024 cho biết điểm mới của Miss Grand Vietnam 2024, cũng tiệm cận với cuộc thi Miss Grand International:  ""Càng ngày chứng minh các hoa hậu, á hậu không phải là những bình hoa di động mà họ là người truyền cảm hứng thông qua việc làm thiện nguyện, những công việc tốt đẹp cho xã hội"". Ban giám khảo cuộc thi năm nay có: hoa hậu Hà Kiều Anh (trưởng ban giám khảo), nghệ sĩ Vương Duy Biên, hoa hậu Nguyễn Thúc Thùy Tiên, Lê Hoàng Phương, Đoàn Thiên Ân, Minh Tú, nhà thiết kế Đỗ Long, diễn viên Quốc Trường. Vòng chung kết Miss Grand Vietnam 2024 dự kiến diễn ra vào tháng 8-2024, tại Phan Thiết, tỉnh Bình Thuận. Dịp này, ban tổ chức Miss Grand Vietnam cũng công bố thông tin thú vị, đó là Việt Nam sẽ đăng cai tổ chức Miss Grand International 2027. Trước đó, Miss Grand International được tổ chức tại Việt Nam vào năm 2023 và 2017.",03/06/2024 19:58 GMT+7,https://tuoitre.vn/hoa-hau-a-hau-khong-phai-la-nhung-binh-hoa-di-dong-20240603193918838.htm,"Đại diện ban tổ chức Miss Grand Vietnam 2024 lý giải 'các hoa hậu, á hậu không phải là những bình hoa di động mà là người truyền cảm hứng thông qua hoạt động thiện nguyện'."
