Title,Content,Date,Url,Summary
Trường đại học Khoa học sức khỏe điều chỉnh cách thức nộp hồ sơ xét tuyển sớm,"Ngày 3-6, Phó thủ tướng Chính phủ Trần Hồng Hà đã ký quyết định thành lập Trường đại học Khoa học sức khỏe là trường đại học thành viên của Đại học Quốc gia TP.HCM.  Năm 2024, nhà trường sẽ tuyển sinh đại học chính quy ra sao? Tuyển sinh 5 ngành, theo 9 phương thức Năm 2024, Trường đại học Khoa học sức khỏe (Khoa Y Đại học Quốc gia TP.HCM cũ) tuyển sinh 5 ngành trình độ đại học: 1. Ngành y khoa (150 chỉ tiêu chính quy và 80 chỉ tiêu theo đặt hàng) 2. Ngành răng - hàm - mặt (50 chỉ tiêu),  3. Dược học (50 chỉ tiêu) 4. Ngành y học cổ truyền (75 chỉ tiêu) 5. Ngành điều dưỡng (150 chỉ tiêu). Nhà trường tuyển sinh theo 9 phương thức dựa theo điểm thi, điểm đánh giá năng lực, điểm học tập THPT, kết quả các kỳ thi quốc tế và kết quả học đại học ngành gần, cụ thể: - Phương thức 1: Xét tuyển dựa trên kết quả thi đánh giá năng lực năm 2024 và kết quả học tập THPT (5% - 10% tổng chỉ tiêu của ngành). Điểm xét tuyển = Điểm thi đánh giá năng lực năm 2024 do Đại học Quốc gia TP.HCM tổ chức *60% + Điểm trung bình cộng của điểm trung bình các môn trong 3 năm lớp 10, 11, 12 theo thang điểm 1200 * 40% - Phương thức 2: Xét tuyển thẳng theo quy chế tuyển sinh đại học chính quy hiện hành của Bộ Giáo dục và Đào tạo và ưu tiên xét tuyển thẳng theo quy định của Đại học Quốc gia TP.HCM (5% tổng chỉ tiêu ngành). Đối tượng 1 (xét tuyển thẳng theo quy chế tuyển sinh của bộ): Xét tuyển theo hướng dẫn của Bộ Giáo dục và Đào tạo; Đối tượng 2 (ưu tiên xét tuyển thẳng theo quy định của Đại học Quốc gia TP.HCM): Điểm xét tuyển = Tổng điểm 3 môn khối B00 (toán, hóa, sinh) trong 3 năm lớp 10, 11, 12 (9 cột điểm). - Phương thức 3: Xét tuyển dựa trên kết quả các kỳ thi quốc tế SAT, ACT, IB, A-level hoặc tương đương (10% tổng chỉ tiêu ngành). Điểm xét tuyển = Điểm thi chứng chỉ quốc tế (quy về thang điểm 100 và làm tròn đến 2 chữ số thập phân) - Phương thức 4: Xét tuyển thí sinh tốt nghiệp đại học ngành gần (5% tổng chỉ tiêu của ngành) Điểm xét tuyển = Điểm trung bình tích lũy tốt nghiệp đại học (quy về thang điểm 10 và làm tròn đến 2 chữ số thập phân) - Phương thức 5: Kết hợp kết quả học tập THPT và văn bằng, chứng nhận chuyên môn (5% tổng chỉ tiêu ngành). Điểm xét tuyển = Tổng điểm 3 môn khối B00 trong 3 năm lớp 10, 11, 12 (9 cột điểm). - Phương thức 6: Ưu tiên xét tuyển theo quy định của Đại học Quốc gia TP.HCM năm 2024 (15% - 20% tổng chỉ tiêu ngành). Điểm xét tuyển = Tổng điểm 3 môn khối B00 trong 3 năm lớp 10, 11, 12 (9 cột điểm). - Phương thức 7: Xét tuyển dựa trên kết quả kỳ thi đánh giá năng lực của Đại học Quốc gia TP.HCM năm 2024 (45% tổng chỉ tiêu ngành). Điểm xét tuyển = Điểm thi đánh giá năng năm 2024 do Đại học Quốc gia TP.HCM tổ chức + Điểm ưu tiên đối tượng, khu vực theo thang điểm 1.200 (nếu có). - Phương thức 8: Xét tuyển dựa trên kết quả kỳ thi tốt nghiệp THPT năm 2024 (>5% tổng chỉ tiêu ngành). Điểm xét tuyển = Điểm thi theo tổ hợp môn B00 + Điểm ưu tiên đối tượng, khu vực theo thang điểm 30 (nếu có). - Phương thức 9: Kết hợp kết quả thi tốt nghiệp THPT năm 2024 và chứng chỉ tiếng Anh quốc tế (<10% tổng chỉ tiêu ngành). Điểm xét tuyển = Điểm thi theo tổ hợp môn B00 + Điểm ưu tiên đối tượng, khu vực theo thang điểm 30 (nếu có). Điều chỉnh cách thức nộp hồ sơ của các phương thức xét tuyển sớm Nhà trường vừa công bố điều chỉnh cách thức nộp hồ sơ xét tuyển của 5/7 phương thức xét tuyển sớm năm 2024 gồm phương thức 1, 2 (đối tượng 1), 3, 4, 5. Thí sinh nộp hồ sơ xét tuyển theo 3 bước: Bước 1: Thí sinh thực hiện đăng ký xét tuyển trên hệ thống Bước 2: Thí sinh đóng lệ phí xét tuyển Bước 3: Nộp hồ sơ trực tuyến. Thời hạn nộp hồ sơ đăng ký xét tuyển các phương thức xét tuyển sớm trên đến ngày 15-6. Riêng thí sinh thuộc đối tượng 1 của phương thức 2 đăng ký đến hết ngày 30-6. Thời gian và cách thức đăng ký chi tiết tại đây.",04/06/2024 16:41 GMT+7,https://tuoitre.vn/truong-dai-hoc-khoa-hoc-suc-khoe-dieu-chinh-cach-thuc-nop-ho-so-xet-tuyen-som-20240604163316491.htm,Trường đại học Khoa học sức khỏe (Khoa Y Đại học Quốc gia TP.HCM cũ) công bố điều chỉnh cách thức nộp hồ sơ xét tuyển sớm năm 2024.
Đại học quốc gia các nước ASEAN có bao nhiêu trường thành viên?,"Mô hình đại học quốc gia khá phổ biến ở các nước Đông Nam Á. Mỗi đại học đều có nhiều trường, khoa trực thuộc, chưa kể các viện nghiên cứu, trung tâm đào tạo khác... Đại học Quốc gia Singapore: 16 Đại học Quốc gia Singapore (NUS) hiện có 16 trường, khoa thành viên, nằm trên 3 học khu (campus) là Kent Ridge, Bukit Timah và Outram. Đây được xem là một trong những mô hình đại học quốc gia hoàn chỉnh nhất trong khu vực. Một số trường thành viên nổi tiếng của Đại học Quốc gia Singapore có thể kể đến như Trường Kinh doanh, Trường Chính sách công Lý Quang Diệu, Trường Y Yong Loo Lin, Trường Y tế công cộng Saw Swee Hock… Ngoài ra còn có Trường đại học Y Yale - NUS, do Đại học Quốc gia Singapore hợp tác cùng Đại học Yale (Mỹ). Tương đương quy mô cấp trường là các khoa như Khoa Luật, Công nghệ thông tin, Khoa Nha… Các khoa này hoạt động giống như các trường đại học, phần lớn tuyển sinh ở cả hệ đại học và sau đại học. Theo Đại học Quốc gia Singapore, 16 trường, khoa thành viên hiện đang cung cấp hơn 4.000 chương trình học mỗi học kỳ. Những năm gần đây, Đại học Quốc gia Singapore ghi nhận sự hợp nhất của các khoa, trường thành viên nhằm gia tăng khả năng đào tạo liên ngành cho người học. Điển hình vào năm 2021, Trường đại học Công nghệ và Thiết kế được thành lập từ sự hợp nhất giữa Khoa Kỹ thuật và Trường Thiết kế và Môi trường, nhằm phát triển một mô hình giáo dục liên ngành mới, tận dụng sự kết hợp giữa hai lĩnh vực. Ngoài ra, Đại học Quốc gia Singapore cũng thành lập Trường học tập suốt đời (NUS SCALE).  Trường cung cấp những chương trình học miễn phí và có phí với các khóa học kỹ năng, nâng cao nghề nghiệp cả trực tuyến lẫn trực tiếp.  Những cựu sinh viên Đại học Quốc gia Singapore thường có thể học tập miễn phí. Bên cạnh các cơ sở đào tạo, Đại học Quốc gia Singapore hiện có thêm 37 viện, trung tâm nghiên cứu cấp đại học. Đại học Quốc gia Malaysia: 13 Đại học Quốc gia Malaysia (Universiti Kebangsaan Malaysia - UKM) hiện có 13 trường, khoa thành viên, cung cấp các chương trình đào tạo từ cử nhân đến tiến sĩ. Ngoài Trường Kinh doanh còn có các Khoa Khoa học xã hội và Nhân văn, Khoa Luật, Khoa Nha, Khoa Kỹ thuật và Môi trường xây dựng, Khoa Khoa học và Công nghệ, Khoa Giáo dục, Khoa Kinh tế và Quản lý, Khoa Y… Mỗi khoa, trường thành viên tại Đại học Quốc gia Malaysia thường cung cấp 10-20 chương trình đào tạo cử nhân, bao gồm định hướng khoa học thuần túy và ứng dụng. Các trường thành viên của Đại học Quốc gia Malaysia (UKM) có sự kết nối chặt chẽ với nhau trong cả đào tạo và nghiên cứu. UKM thực hiện nhiều chương trình liên ngành giữa các khoa, tạo điều kiện cho sinh viên và giảng viên tham gia vào các dự án nghiên cứu chéo lĩnh vực.  Ví dụ, các khoa như Khoa Khoa học và Công nghệ và Khoa Y có thể cộng tác trong các lĩnh vực như sinh học phân tử hoặc các ứng dụng AI áp dụng trong y tế. Đại học Quốc gia Philippines: 7 Tại Philippines, mô hình đại học quốc gia có phần khác biệt khi chú trọng vào sự phân bổ rộng về vị trí địa lý. Đại học Quốc gia Philippines (University of the Philippines - UP) là một hệ thống đại học bao gồm 7 trường đại học thành viên và một trường cao đẳng, phân bố trên nhiều địa phương khác nhau trên cả nước. Có thể kể đến như UP Diliman là cơ sở lớn nhất, chiếm khoảng một nửa sinh viên của UP có các chương trình đào tạo đa ngành. UP Manila tập trung vào khoa học sức khỏe, tiếp nối truyền thống từ Trường Y khoa Philippines. UP Los Baños chuyên về lâm nghiệp, nông nghiệp và các nghiên cứu môi trường, có di sản mạnh mẽ về kỹ thuật sinh học và chọn giống cây trồng. UP Visayas tập trung vào ngành khoa học thủy sản và biển, tọa lạc tại bờ biển phía nam của đảo Panay. Mỗi trường thành viên trong hệ thống UP gắn với sự phát triển của các lĩnh vực chuyên môn hóa phù hợp với địa phương mà trường thành viên đặt cơ sở.",04/06/2024 16:16 GMT+7,https://tuoitre.vn/dai-hoc-quoc-gia-cac-nuoc-asean-co-bao-nhieu-truong-thanh-vien-20240604143013762.htm,"Đại học Quốc gia TP.HCM vừa có thêm trường đại học thành viên thứ 8. So với các đại học quốc gia khác, con số này nhiều hay ít?"
"Đề văn thi vào lớp 10 Hải Phòng: Thí sinh khen hay, tình cảm","Sáng 4-6, gần 26.000 thí sinh tại thành phố Hải Phòng dự thi môn văn, với thời gian làm bài 120 phút. Đây là môn thi đầu tiên của kỳ thi tuyển sinh vào lớp 10 THPT năm học 2024-2025 của thành phố. Em Nguyễn Phương Linh - thí sinh dự thi tại hội đồng thi Trường THPT Lê Chân, quận Lê Chân - cho biết đề thi có 2 phần gồm Đọc hiểu và Làm văn. Toàn bộ phần Đọc hiểu và câu 1 của phần Làm văn trong bài thi đều tập trung vào đoạn trích thơ ""Thành phố không hoàng hôn"" của Hải Như. Đây là đoạn thơ nổi tiếng đã được phổ nhạc thành bài hát ""Thành phố Hoa phượng đỏ"" rất nổi tiếng và thân thuộc với mỗi người dân thành phố cảng. Do đó, em rất tự tin làm bài. Theo đánh giá chung của các thí sinh, đề thi môn ngữ văn vào lớp 10 rất gần gũi với tình cảm, lứa tuổi của các em. Đây là đề thi hay. Thông tin từ Sở Giáo dục và Đào tạo Hải Phòng, trong kỳ thi này, toàn thành phố có 44 hội đồng thi đại trà với tổng số 1.062 phòng thi; 25.671 thí sinh dự thi. Để chuẩn bị cho công tác thi, ngành giáo dục và đào tạo thành phố huy động 3.144 cán bộ giáo viên, nhân viên tham gia coi thi. Trong chiều nay, các thí sinh tiếp tục thi môn ngoại ngữ với thời gian làm bài 60 phút, và thi môn toán trong sáng mai 5-6 với thời gian làm bài 120 phút. Các thí sinh đăng ký dự thi vào Trường THPT chuyên Trần Phú sẽ tiếp tục dự thi trong hai ngày 7 và 8-6. Đề thi văn vào lớp 10 ở Hải Phòng: Cũng trong hôm nay, các thí sinh thi vào lớp 10 ở Bình Định và Bình Phước thi môn ngữ văn. Đề thi văn ở hai địa phương này như sau: Trước đó ngày 3-6, các thí sinh ở Bình Thuận cũng dự thi môn văn vào lớp 10, đề thi như sau:",04/06/2024 15:57 GMT+7,https://tuoitre.vn/de-van-thi-vao-lop-10-hai-phong-thi-sinh-khen-hay-tinh-cam-20240604153323617.htm,"Theo đánh giá chung của các thí sinh, đề môn văn thi vào lớp 10 ở Hải Phòng rất gần gũi với tình cảm, lứa tuổi của các em. Đây là đề thi hay."
Thi vào lớp 10 ở TP.HCM: 6 thí sinh thi tại phòng riêng có camera,"Chiều 4-6, thông tin về công tác chuẩn bị kỳ thi vào lớp 10 năm học 2024-2025, ông Lê Hoài Nam - phó giám đốc Sở Giáo dục và Đào tạo TP.HCM, cho biết kỳ thi năm nay có 98.681 thí sinh tham dự. Trong đó, thí sinh đăng ký xét 3 nguyện vọng thường là 98.681; đăng ký xét nguyện vọng chuyên là 7.622. Sở Giáo dục và Đào tạo TP.HCM đã bố trí 158 điểm thi, trong đó có 11 điểm thi chuyên. ""Kỳ thi lần này có 6 thí sinh đặc biệt, bị tai nạn nên phải thi tại phòng riêng. Trong đó, có 1 thí sinh bị lệch cột sống, phải nằm viết; 5 thí sinh còn lại bị gãy tay phải.  Sở đã bố trí các giám thị là giáo viên không cùng môn thi, thuộc trường khác ngoài quận với thí sinh; gắn camera giám sát ở các phòng thi đồng thời cử cán bộ y tế theo dõi với những trường hợp đặc biệt"", ông Nam cho biết. Theo Sở Giáo dục và Đào tạo TP.HCM, tất cả các trường hợp thí sinh có mặt tại cổng điểm thi chậm quá 15 phút sau khi có hiệu lệnh tính giờ làm bài sẽ không được dự thi. Vì vậy, thí sinh cần phải có mặt tại phòng thi đúng thời gian quy định cho từng buổi thi.  Thí sinh cần mang theo phiếu báo danh có dán hình, giấy khai sinh (bản photo không cần công chứng) để đối chiếu hồ sơ, thẻ học sinh hoặc thẻ bảo hiểm y tế hoặc căn cước công dân có gắn chip.  Nếu thí sinh bị mất một trong các loại giấy tờ trên hoặc thấy có những sai sót về họ, tên đệm, tên, ngày, tháng, năm sinh, đối tượng ưu tiên… phải báo ngay cho cán bộ coi thi hoặc người làm nhiệm vụ tại điểm thi để xử lý kịp thời.",04/06/2024 15:31 GMT+7,https://tuoitre.vn/thi-vao-lop-10-o-tp-hcm-6-thi-sinh-thi-tai-phong-rieng-co-camera-20240604152046485.htm,Kỳ thi vào lớp 10 ở TP.HCM diễn ra ngày 6 và 7-6 có 6 thí sinh thi tại phòng riêng. Các phòng thi này đều có camera giám sát.
Đề chuyên văn vào lớp 10 Đà Nẵng về 'sống ảo' được cô trò khen nức nở,"Ngày 4-6, hơn 1.500 thí sinh hoàn thành bài thi môn chuyên tranh 300 suất vào Trường THPT chuyên Lê Quý Đôn Đà Nẵng. Thí sinh nói đề chuyên văn thời sự Cụ thể, phần nghị luận xã hội đề chuyên văn vào lớp 10 Đà Nẵng kể về câu chuyện một cô bé 16 tuổi, được tặng máy ảnh và thích thú khi được nhiều người khen những bức ảnh của mình. Đến một hôm về quê, có một cảnh đẹp, em đưa máy ảnh lên chụp thì hết pin. Em buồn thất vọng đến phát khóc. Lúc này cậu em trai của cô bé liền bảo: ""Không chụp được thì lo ngắm đi, có gì mà khóc? Chị còn đôi mắt nữa mà…"". Thí sinh Nguyễn Nhã Anh Thư (Trường THCS - THPT Nguyễn Khuyến) cho biết:  ""Em cảm thấy đề văn năm nay khá vừa sức với các bạn học chuyên. Đề nghị luận xã hội có thể mở rộng ra nhiều bài học khác nhau làm cho bài viết phong phú hơn"". Chung nhận định, thí sinh Phan Nguyên Chi Mai (Trường THCS - THPT Nguyễn Khuyến) nói:  ""Đề văn chuyên 10 năm nay quá hay, đặc biệt là phần nghị luận xã hội rất thời sự. Đề nhìn chung khá dễ chịu, các bạn phòng thi của em ai cũng làm bài ổn, ra về trong rạng rỡ"". Một đề văn ""đẹp"" Cô Hoàng Yến Phi, giáo viên dạy văn Trường THCS - THPT Nguyễn Khuyến, đánh giá câu 1 phần nghị luận xã hội có ngữ liệu hay, vấn đề sát, hợp với tâm lý lứa tuổi học sinh và thực tiễn đời sống. Ý tưởng khơi gợi tư duy sáng tạo. Với câu 2, cô Yến Phi cho rằng đề bài bám sát yêu cầu về kỹ năng và kiến thức ngữ văn của học sinh THCS, phát triển nâng cao về năng lực cảm nhận và nghị luận của đối tượng học sinh giỏi. Đề bài tường minh, gợi cảm hứng tốt. ""Tuy nhiên, câu lệnh của câu 1 và câu 2 có phần chưa tương ứng. Cụ thể câu 1 yêu cầu viết bài văn, câu 2 không yêu cầu về hình thức"", cô Yến Phi cho biết. Cô Huỳnh Thị Thu Ba (nguyên giáo viên văn Trường chuyên Lê Quý Đôn Đà Nẵng) nhận định trong thời kỳ những trang thiết bị hiện đại, tiện lợi thống trị, con người dễ bị cuốn vào thế giới quá nhiều sự lựa chọn, quá nhiều niềm vui và lời khen ngợi, bị phụ thuộc để rồi có khi quên đi những giá trị nguyên sơ, cốt lõi mà giản dị. ""Vấn đề câu nghị luận xã hội đặt ra đã đến đúng thời điểm, đem lại sự thức tỉnh nhẹ nhàng mà sâu lắng.  Chỉ khi bạn biết ngắm nhìn thế giới xung quanh bằng đôi mắt của chính mình, bằng tất cả giác quan, bằng tâm hồn thực sự biết rung cảm trước những vẻ đẹp bình dị của cuộc sống thì lúc ấy bạn mới thực sự có được những khoảnh khắc hạnh phúc giá trị nhất của cuộc sống mà bạn đang thực sống"", cô Thu Ba nói. Vấn đề trong phần nghị luận văn học theo cô Thu Ba là khá quen thuộc với học sinh giỏi: Sứ mệnh người nghệ sĩ là phải phản ánh cái đẹp bằng sự rung động mãnh liệt của trái tim và tài năng nghệ thuật của riêng mình; lan tỏa cái nhìn đẹp, cảm xúc đẹp đến với độc giả. Cô Thu Ba cho rằng vấn đề được chứa đựng trong một nhận định rõ ràng, không đánh đố. Song, để giải quyết thấu đáo đòi hỏi thí sinh phải có khả năng xử lý tốt dẫn chứng.  Thí sinh cần có độ nhạy bén trong việc lựa chọn các tác phẩm trong chương trình THCS để bao quát được hết các nội dung đặt ra trong luận đề.",04/06/2024 14:11 GMT+7,https://tuoitre.vn/de-chuyen-van-vao-lop-10-da-nang-ve-song-ao-duoc-co-tro-khen-nuc-no-20240604135218436.htm,Đề chuyên văn thi vào lớp 10 Đà Nẵng được cả thí sinh và giáo viên đánh giá rất hay và thời sự.
Không chấp nhận văn bằng 2 ngôn ngữ Anh khi xét tuyển tiến sĩ?,"Theo thông tin từ giảng viên một trường đại học tại TP.HCM, một số đồng nghiệp của ông khi nộp hồ sơ xét tuyển tiến sĩ ở Trường đại học Sài Gòn, Trường đại học Sư phạm TP.HCM đã bị trường từ chối. Theo ông này, lý do là không đủ chuẩn đầu vào ngoại ngữ do bằng cử nhân tiếng Anh (văn bằng 2 hình thức từ xa) Trường đại học Trà Vinh cấp có số lượng tín chỉ ít. Muốn được công nhận phải học bổ sung một số tín chỉ. Một người khác cho biết cũng nghe thông tin Trường đại học Y Dược TP.HCM không công nhận bằng cử nhân ngôn ngữ Anh (văn bằng 2) do Trường đại học Trà Vinh cấp khi xét tuyển tiến sĩ. Hiện nay có rất nhiều trường đại học đào tạo văn bằng 2 ngành ngôn ngữ Anh. Các trường đào tạo theo hình thức trực tuyến hoặc trực tiếp. Chương trình đào tạo ngành ngôn ngữ Anh (văn bằng 2, hình thức đào tạo từ xa) của Trường đại học Trà Vinh có 84 tín chỉ. Trong đó, có 4 tín chỉ về tổng quan e-learning, 8 tín chỉ ngoại ngữ 2, 72 tín chỉ chuyên ngành. Trao đổi với Tuổi Trẻ Online, các trường đại học khẳng định không có việc không công nhận bằng cử nhân ngoại ngữ văn bằng 2 hoặc phải học bổ sung để được công nhận đầu vào tiến sĩ. Đại diện Trường đại học Sài Gòn cho biết tất cả bằng cử nhân ngoại ngữ hợp pháp đều được công nhận khi xét tuyển đầu vào tiến sĩ. Bằng cử nhân ngoại ngữ văn bằng 2 cũng là bằng cấp năm trong hệ thống văn bằng quốc gia. Trường chỉ thực hiện xác minh văn bằng do người học nộp vào. Tương tự, PGS.TS Phạm Nguyễn Thành Vinh - trưởng phòng đào tạo sau đại học Trường đại học Sư phạm TP.HCM - cho biết thông tin này không chính xác. Ông này cho biết bằng cử nhân ngoại ngữ hợp pháp đều được công nhận. Đây là quy định của Bộ Giáo dục và Đào tạo. ""Tuy nhiên trường có quy trình xác nhận văn bằng, chứng chỉ. Văn bằng, chứng chỉ do người học nộp vào đều được trường gửi công văn xác nhận với nơi cấp. Điều này nhằm đảm bảo tính pháp lý cũng như quyền lợi cho người học, tránh những rắc rối sau này"" - ông Vinh nói. Trong khi đó, PGS.TS Mai Phương Thảo - trưởng phòng đào tạo sau đại học Trường đại học Y Dược TP.HCM - cho biết trường hợp không được chấp nhận có thể do người học mới hoàn thành chương trình cử nhân ngôn ngữ Anh mà chưa có bằng tốt nghiệp. ""Theo quy định, thời điểm nộp hồ sơ xét tuyển tiến sĩ ứng viên phải có bằng cử nhân ngoại ngữ. Một số trường có thể chấp nhận giấy chứng nhận tốt nghiệp tạm thời. Theo quy định, trường chấp nhận bằng cử nhân ngoại ngữ (văn bằng 2) nếu đó là bằng hợp pháp sau khi xác nhận văn bằng"" - bà Thảo cho biết thêm. Theo thông tư 18/2021 của Bộ Giáo dục và Đào tạo về tuyển sinh, đào tạo tiến sĩ, ngoài các quy định liên quan chuyên môn khi tuyển sinh còn có yêu cầu về ngoại ngữ. Người dự tuyển là công dân Việt Nam phải đạt yêu cầu về năng lực ngoại ngữ được minh chứng bằng một trong những văn bằng, chứng chỉ: bằng tốt nghiệp trình độ đại học trở lên do một cơ sở đào tạo nước ngoài, phân hiệu của cơ sở đào tạo nước ngoài ở Việt Nam hoặc cơ sở đào tạo của Việt Nam cấp cho người học toàn thời gian bằng tiếng nước ngoài. Bằng tốt nghiệp trình độ đại học ngành ngôn ngữ tiếng nước ngoài do các cơ sở đào tạo của Việt Nam cấp. Có một trong các chứng chỉ ngoại ngữ quy định còn hiệu lực tính đến ngày đăng ký dự tuyển. Quy chế của cơ sở đào tạo quy định chi tiết yêu cầu về trình độ chuyên môn phù hợp, năng lực ngoại ngữ, kinh nghiệm công tác và những yêu cầu khác đối với người dự tuyển tùy theo đặc điểm của từng lĩnh vực, ngành đào tạo và chương trình đào tạo cụ thể của cơ sở đào tạo trên cơ sở những yêu cầu tối thiểu quy định tại điều này. ",04/06/2024 13:36 GMT+7,https://tuoitre.vn/khong-chap-nhan-van-bang-2-ngon-ngu-anh-khi-xet-tuyen-tien-si-20240604115247899.htm,Hôm nay một số người xét tuyển tiến sĩ bị trường từ chối vì văn bằng 2 ngành tiếng Anh không được công nhận do số tín chỉ ít.
