Title,Content,Date,Url,Summary
Phim Hollywood sẽ phủ sóng Liên hoan phim Venice năm nay?,"Theo nguồn tin từ Variety, Liên hoan phim Venice 2024 sẽ có sự góp mặt nhiều tên tuổi lớn của kinh đô điện ảnh Hollywood như: Lady Gaga, Joaquin Phoenix, Angelina Jolie, Daniel Craig, Johnny Depp, George Clooney, Brad Pitt, Gal Gadot hay Ana de Armas. Nhiều tác phẩm nặng ký từ Hollywood  Lady Gaga và Joaquin Phoenix sẽ đóng cặp trong Joker 2: Folie à Deux (tạm dịch: Joker 2: Điên có đôi), phần tiếp theo của phim về nguồn gốc ác nhân Joker từng đoạt giải Sư Tử Vàng năm 2019. Một phim cũng đang nhận nhiều sự chú ý là Maria, kể về câu chuyện cuộc đời Maria Callas - người được mệnh danh là diva đầu tiên trong lịch sử. Người thủ vai danh ca huyền thoại là Angelina Jolie, cô trở lại một vai diễn hàn lâm sau nhiều năm đóng những bộ phim thương mại bom tấn như Eternals, Maleficent,... Hai phim trên được đánh giá là nặng ký bậc nhất trong Liên hoan phim Venice năm nay khi Pablo Larraín (đạo diễn Maria), Todd Phillips (Joker 2) đều là những cái tên từng gây tiếng vang tại Venice và các giải thưởng hàn lâm lớn. Johnny Depp trở lại ghế đạo diễn Ngoài ra Venice còn chào đón sự trở lại của Johnny Depp trong vai trò đạo diễn với Modi, lấy cảm hứng từ cuộc đời danh họa người Ý Amedeo Modigliani (Riccardo Scamarcio thủ vai), diễn viên gạo cội Al Pacino cũng góp mặt. Chàng điệp viên 007 Daniel Craig cũng tái xuất trong phim Queer chuyển thể từ tiểu thuyết cùng tên của William S. Burroughs. Queer kể câu chuyện tình yêu đồng tính về một người Mỹ đang chiến đấu với cơn nghiện ma túy tại Mexico đem lòng say mê một người lính hải quân. Một phim đáng chú ý khác là In the Hand of Dante do Julian Schnabel đạo diễn (ông từng làm At Eternity’s Gate). Nội dung của phim xoay quanh hành trình bản thảo viết tay bài thơ The Divine Comedy (Thần khúc - Dante Alighieri) vô tình thất lạc từ thư viện Tòa thánh Vatican và rơi vào tay một ông trùm băng đảng. Đây là một phim toàn sao khi có sự góp mặt của dàn diễn viên đình đám Oscar Isaac, Jason Momoa, Gerard Butler, Al Pacino. Đặc biệt, đạo diễn Martin Scorsese cũng sẽ sắm một vai trong In the Hand of Dante. Ở hạng mục không tranh giải, có hai phim cũng khá đáng chú ý là Wolfs do ông lớn Apple TV đầu tư, đánh dấu sự tái hợp của hai cái tên đình đám Brad Pitt và George Clooney cùng phim Eden gồm toàn sao nữ hàng đầu thế hệ Hollywood mới như Ana de Armas, Sydney Sweeney và Jude Law.",02/06/2024 11:53 GMT+7,https://tuoitre.vn/phim-hollywood-se-phu-song-lien-hoan-phim-venice-nam-nay-20240602103852228.htm,"Liên hoan phim Venice năm nay là cuộc tranh tài của nhiều sao hàng đầu Hollywood như Johnny Depp, Brad Pitt, Angelina Jolie, Joaquin Phoenix..."
"Dù bị chê, hoa hậu H'Hen Niê vẫn tiếp tục hát","Sau MV chủ đề chiến dịch Ngừng ăn thịt thú rừng - Góp thiện cho đời, H'Hen Niê tiếp tục phát hành MV Nụ cười Việt Nam dù trước đó cô nhận nhiều ý kiến chê giọng hát. H'Hen Niê khẳng định mình không phải ca sĩ H'Hen Niê cho biết MV Nụ cười Việt Nam không phải là sản phẩm debut của cô. MV là món quà âm nhạc mang thông điệp ý nghĩa hướng đến cộng đồng mà cô và ê kíp dành tặng khán giả. Lần này H'Hen Niê đảm nhận vai trò người kết nối, gửi thông điệp ý nghĩa qua âm nhạc, để chạm đến cảm xúc của mỗi người. H'Hen Niê giải thích với Tuổi Trẻ Online: ""Hen biết giọng hát của mình chưa hay nhưng Hen nghĩ rằng âm nhạc cũng là một cách để kết nối với khán giả và mang những giá trị tích cực cho xã hội. Hen muốn thông qua âm nhạc để truyền tải những thông điệp nhân văn. Và Nụ cười Việt Nam là một ca khúc cho Hen nhiều cảm xúc, với hy vọng gửi đến cho khán giả và bạn bè quốc tế thông điệp bình dị về niềm hạnh phúc giản đơn có thể trao nhau, đó là Nụ cười Việt Nam"". H'Hen Niê cho biết thêm đây là món quà âm nhạc thể hiện sự biết ơn đối với các anh hùng liệt sĩ, thế hệ cha ông đã cho chúng ta cuộc sống yên bình và nụ cười hạnh phúc. Trước đó giọng hát của H'Hen Niê bị chê nhưng cô đều vui vẻ đón nhận và cho rằng rất cần những ý kiến đóng góp của khán giả để cô hoàn thiện hơn. ""Hen không phải là ca sĩ, Hen hát bằng cảm xúc và đó cũng là cách để Hen nói lên những thông điệp cộng đồng mà mình đang theo đuổi. Hen vẫn luyện thanh kể từ sau chương trình Chị đẹp đạp gió rẽ sóng. Tuy nhiên cường độ không nhiều bằng khi tham gia chương trình nhưng Hen vẫn sắp xếp để luyện thanh và vũ đạo"" - H'hen Niê chia sẻ. Truyền năng lượng tích cực qua nụ cười Ca khúc Nụ cười Việt Nam do nhạc sĩ Trương Quý Hải sáng tác. H'Hen Niê quyết định quay MV ca khúc này vì muốn thông qua âm nhạc sẽ truyền tải những thông điệp ý nghĩa nhanh chóng hơn và tiếp cận được nhiều người hơn. MV Nụ cười Việt Nam quay hình ba ngày tại tỉnh Điện Biên.  Có lúc cô mặc trang phục dân tộc Thái hát ở cao nguyên đá Tủa Chùa, có lúc cô đeo chiếc gùi đi qua những địa điểm nổi tiếng của Điện Biên: cầu treo Pa Phông, Bảo tàng Chiến thắng Điện Biên Phủ… Ngoài ra, trong MV còn có những phân cảnh H'Hen Niê hát cùng người dân địa phương, các em học sinh… tất cả thể hiện sự kết nối và đặc biệt là hình ảnh nụ cười hạnh phúc của nhiều người.",02/06/2024 11:26 GMT+7,https://tuoitre.vn/du-bi-che-hoa-hau-h-hen-nie-van-tiep-tuc-hat-20240602102700118.htm,H'Hen Niê nói với Tuổi Trẻ Online cô biết giọng hát của mình chưa hay nhưng muốn dùng âm nhạc để trò chuyện với khán giả và gửi những giá trị tích cực đến cộng đồng.
Thời của nhạc ngắn 2 phút,"I Had Some Help của Post Malone và Morgan Wallen dài 2 phút 58 giây. Million Dollar Baby của Tommy Richman dài 2 phút 35 giây. A Bar Song (Tipsy) của Shaboozey là 2 phút 53 giây. Cuối cùng là Lunch của Billie Eilish, 2 phút 59 giây. Nhạc ngắn là xu hướng mới? Ngay cả trong album mới của Beyoncé, Cowboy Carter, một album được coi là rất dài, tận 78 phút, nhưng khi chia đều ra thì mỗi bài cũng không tới 3 phút. Các ca khúc của Taylor Swift không đến mức ngắn thế, nhưng ngay cả với Swift thì theo thời gian, độ dài trung bình các bài hát trong các album cũng giảm dần, từ Speak Now gần 5 phút một bài đến Midnights cũng chỉ còn khoảng 3 phút rưỡi. Đây không chỉ là xu hướng ở US-UK. Khi nhóm nhạc nữ NewJeans của K-pop ra mắt mini album Get Up, người hâm mộ cũng phàn nàn, ngắn quá! Mini album có tới 6 track nhạc, nhưng tổng thời gian chỉ khoảng 12 phút. Bài ngắn nhất 37 giây. Bài dài nhất 2 phút 35 giây. Còn tại Việt Nam, hiện tượng này rất rõ ở nghệ sĩ trẻ: từ Loi Choi: The Neo Pop Punk của Wren Evans đến Em của Mỹ Anh, từ ái của tlinh đến 99% của rapper MCK, tất cả đều có thời lượng một bài trung bình chỉ hơn 2 phút. Cả thế giới dường như đều không còn hứng thú nghe những ca khúc trường thiên. Đâu rồi cái thời thịnh trị của rock những năm 1970 - 1980, khi nghe một ca khúc của Gun ""n"" Roses hay Led Zeppelin cũng đã dài tới tận mười mấy phút? Đi kèm với sự ngắn gọn là sự tối giản về lời ca. Báo cáo từ một nghiên cứu dựa vào hơn 350.000 ca khúc tiếng Anh đăng trên tạp chí Nature, xu hướng chung trong các ca khúc hiện đại là ngôn từ ngày một đơn giản hơn, cấu trúc ca khúc cũng ngày một ít phức tạp hơn, lặp đi lặp lại cùng một câu nhiều hơn. Phải chăng các nhạc sĩ đang ngày càng làm biếng? Nhiều người đổ cho TikTok. Sự lên ngôi của âm nhạc mì ăn liền, chỉ nhanh nhanh chóng chóng nhảy ùm vào một đoạn hook hay điệp khúc bắt tai? Chắc chắn là do TikTok khuyến khích. Khả năng tập trung ngày một thui chột? Cũng là do văn hóa video ngắn TikTok lan tỏa mà ra cả. Bên cạnh TikTok, nền tảng nghe nhạc trực tuyến Spotify cũng thường bị cho là thủ phạm của sự đơn điệu hóa ca khúc. Khán giả phải nghe ít nhất 30 giây để lượt stream mang lại doanh thu cho nghệ sĩ. Vậy thì ca khúc càng ngắn, càng sớm đi vào phần hấp dẫn càng tốt. Chưa kể, nghe một bản All Too Well dài 10 phút của Taylor Swift thì số tiền thu được cũng chỉ ngang với bản All Too Well gốc dài hơn 3 phút. Vậy thì ngoài một số người có sẵn ""đặc quyền"" dù đăng nhạc ngắn ra sao cũng có sẵn đông đảo người nghe, với những người còn lại, tại sao họ phải sáng tác nhạc dài? Âm nhạc lúc này trở thành một bài toán kinh tế chứ không chỉ là một cảm hứng sáng tạo nữa. Tuy nhiên, đã có thời âm nhạc từng rất ngắn. Suốt những năm 1930 - 1950, vì sự hạn chế của những chiếc đĩa than 78 vòng mà các ca khúc thường đủ ngắn để được lưu giữ ở đó. Phải đến thập niên 1960, khi những chiếc đĩa LP ghi được 22 phút âm thanh ra đời thì các ca khúc mới bắt đầu dài hơi hơn, và ta bắt đầu có những Hey Jude hay A Day in The Life dài 6, 7 phút của The Beatles. Mặc dù có thể cho rằng thời xa xưa, nhạc sĩ làm nhạc ngắn vì không còn lựa chọn nào khác, và điều đó về bản chất là khác với hiện nay, khi các nhạc sĩ chủ đích làm nhạc ngắn để tối ưu hiệu quả kinh tế. Nhưng chẳng phải lịch sử của những xu hướng thẩm mỹ luôn là một đường xoáy trôn ốc? Ta sẽ luôn thấy mình quay trở lại nơi đã từng. Và biết đâu, trong vài năm nữa, khi những ca khúc ngắn bão hòa thì sẽ lại có một lớp nhạc sĩ mới chiều chuộng ta bằng những ca khúc dài không hồi kết? Sự thật là, các ca khúc đang ngày một ngắn đi. Chúng ta còn chưa kịp chìm vào thế giới của một bài ca thì nó đã kết thúc mất rồi.",02/06/2024 10:48 GMT+7,https://tuoitre.vn/thoi-cua-nhac-ngan-2-phut-20240602092817975.htm,"Trong số 5 ca khúc xếp đầu bảng xếp hạng Billboard Hot 100 tuần qua, có tới 4 ca khúc dài dưới 3 phút."
"Erik bán 'bắp luộc đê', Obito hát dưới mưa sôi động đêm nhạc hè Forest Playground","Đêm nhạc Forest Playground 2024 diễn ra tối 1-6, ở công biên bờ sông Sài Gòn (Thủ Đức), có sự tham gia biểu diễn của Erik, Rhyder, Obito, Winno và Sean. Nhiều bản hit và cả ca khúc mới chưa phát hành được các ca sĩ trình diễn, tặng khán giả. Có thời điểm trời mưa nhưng khán giả vẫn che dù xem, cổ vũ nhiệt tình, khiến nghệ sĩ ấm lòng. Obito giữ chân khán giả dù trời mưa Thời điểm Obito trình diễn trời mưa lất phất nhưng khán giả vẫn đứng yên, che dù cổ vũ nhiệt tình cho anh. Obito hát Hà Nội một mình trên sân khấu Forest Playground mà thiếu Vstra khiến khán giả tiếc nuối. Bởi Vstra và Obito là đồng tác giả ca khúc Hà Nội mang đến một góc nhìn mới lạ về thủ đô. Cả hai đều là những rapper trẻ, thể hiện thành công Hà Nội, đưa cả hai đến gần với khán giả. Hát ca khúc tình yêu giữa trời mưa nhưng Obito không cảm thấy cô đơn vì khán giả đội mưa nghe anh hát. Sau đó, Obito khiến khán giả thay đổi cảm xúc cùng bản hit Buồn hay vui với phần góp giọng của Vsoul và Hustlang. Sau phần trình diễn của Obito mưa dần tạnh. Erik bán ""bắp luộc đê"" cùng khán giả Có lẽ phần khán giả mong chờ nhất là sự xuất hiện và biểu diễn của Erik. Anh không làm khán giả thất vọng khi xuất hiện cùng dàn vũ công, khoe vũ đạo ấn tượng. Bản hit Em không sai chúng ta sai vang lên trong sự hò reo, cổ vũ và hát theo của hàng ngàn khán giả, tạo nên hiệu ứng khó quên trong khán giả và cả Erik. Nhiều khán giả cho rằng Erik dần lấy lại phong độ như ban đầu sau một thời gian tạo nên nhiều tranh cãi trong cách xử lý bài hát. Đến với đêm nhạc, anh còn hát Chạy về khóc với anh. Erik cũng không ngần ngại chạy về phía khán giả giao lưu và đưa micro cho khán giả hô to ""bắp luộc đê"". Rhyder cũng khiến sân khấu sôi động bởi ca khúc Sao băng. Đây là một ca khúc mới toanh, lần đầu Rhyder trình diễn trước khán giả. Sao băng là một trong những ca khúc nằm trong album mới được Rhyder phát hành trong thời gian tới. Không những vậy, Rhyder còn khiến khán giả phải nhún nhảy theo qua bản hit Chịu cách mình nói thua, Anh quen với cô đơn… Sean - một ca sĩ Gen Z - chinh phục khán giả với màu sắc riêng qua ca khúc Yêu là đây cùng bản hit gắn liền tên tuổi là Em thích. Còn Winno sở hữu chất giọng khàn đặc trưng, anh mang đến hàng loạt bản hit như: Say đắm trong lần đầu, Tell Ur Mom 2, Giọt nước mắt, Muốn anh đau… Khán giả ấn tượng bởi cách sử dụng flow, lyrics cuốn hút của Winno.",02/06/2024 08:25 GMT+7,https://tuoitre.vn/erik-ban-bap-luoc-de-obito-hat-duoi-mua-soi-dong-dem-nhac-he-forest-playground-20240602070350381.htm,"Gần 4.000 khán giả tham dự, cổ vũ cho các nghệ sĩ trong đêm nhạc đầu tiên nằm trong khuôn khổ Lễ hội mùa hè 2024 diễn ra tại TP.HCM."
"Hoa hậu Lụa di sản Việt Nam sẽ nhận vương miện kèm giải thưởng hơn 2,5 tỉ đồng","Nhà thiết kế Võ Việt Chung - chủ tịch Hoa hậu Lụa di sản Việt Nam 2024, trưởng ban tổ chức - cho Tuổi Trẻ Online biết ban tổ chức bắt đầu nhận hồ sơ dự thi từ nay đến hết ngày 30-9. Dự kiến vòng chung kết sẽ diễn ra cuối tháng 11-2024, tại phố cổ Hội An. Chấp nhận thí sinh phẫu thuật thẩm mỹ  Cuộc thi Hoa hậu Lụa di sản Việt Nam 2024 do Công ty TNHH Silk Fashion World và thành phố Hội An (tỉnh Quảng Nam) phối hợp tổ chức. Đây là mùa tổ chức đầu tiên. Đối tượng dự thi là nữ từ 18 đến 30 tuổi, cao từ 1,6m, có bằng tốt nghiệp trung học phổ thông, chưa lập gia đình, chưa đăng ký kết hôn, chưa sinh con. Thí sinh có thể đã qua phẫu thuật thẩm mỹ nhưng chỉ làm hoàn thiện một số khiếm khuyết như làm răng sứ, lệch hàm, vẹo sống mũi, mắt lác… Nhà thiết kế Võ Việt Chung cho biết các thí sinh đoạt một số danh hiệu trong các cuộc thi hoa hậu, hoa khôi, người đẹp diễn ra trong năm 2022 và 2023 được xem xét đặc cách vào vòng bán kết hoặc chung kết. Người đẹp giành danh hiệu hoa hậu cuộc thi Hoa hậu Lụa di sản Việt Nam 2024 nhận được giải thưởng có tổng giá trị hơn 2,5 tỉ đồng. Á hậu 1 và 2 sẽ nhận tổng giá trị giải thưởng hơn 1 tỉ đồng.  Ngoài ra, ban tổ chức còn trao nhiều giải thưởng phụ, mỗi giải thưởng tổng trị giá 100 triệu đồng. Giữ gìn, phát huy làng nghề truyền thống Với chủ đề ""Hành trình dệt gấm thêu hoa"", cuộc thi Hoa hậu Lụa di sản Việt Nam 2024 đề cao những giá trị truyền thống tốt đẹp, trang phục truyền thống, đặc biệt là các làng nghề truyền thống, trong đó có làng nghề dệt lụa. Đây cũng là lý do ban tổ chức chọn Hội An là nơi tổ chức cuộc thi. Hội An được nhiều người biết đến là một địa phương có ngành may mặc phát triển. Còn tỉnh Quảng Nam là một trong những cái nôi của ngành tơ tằm của nước ta. Thông qua cuộc thi này, ban tổ chức mong muốn tôn vinh các giá trị truyền thống, đồng thời quảng bá đến đông đảo bạn bè quốc tế. Điều thú vị, trong khuôn khổ cuộc thi, ban tổ chức sẽ tổ chức cuộc thi thiết kế áo dài truyền thống. ""Các thiết kế tôn dáng, mang đậm dấu ấn áo dài truyền thống. Các thí sinh có thể thiết kế cách điệu nhưng trong chừng mực. Thí sinh thiết kế trên chất liệu lụa của nước ta như lụa Vạn Phúc, lụa Hà Đông, Lãnh Mỹ A…"" - Võ Việt Chung cho biết thêm.",01/06/2024 17:18 GMT+7,https://tuoitre.vn/hoa-hau-lua-di-san-viet-nam-se-nhan-vuong-mien-kem-giai-thuong-hon-2-5-ti-dong-2024053116195144.htm,"Đại diện ban tổ chức cuộc thi Hoa hậu Lụa di sản Việt Nam 2024 cho biết giá trị giải thưởng dành cho ngôi vị hoa hậu hơn 2,5 tỉ đồng. Tổng giải thưởng cuộc thi hơn 4,5 tỉ đồng gồm tiền mặt và quà tặng."
Tin tức giải trí 1-6: Lật mặt 7 chinh chiến nước ngoài; Phương Mỹ Chi đóng phim kinh dị,"Phương Mỹ Chi đóng chính phim của Huỳnh Lập Sáng 1-6, buổi lễ khai máy phim điện ảnh Nhà gia tiên của đạo diễn Huỳnh Lập diễn ra, với sự tham gia của ê kíp và dàn diễn viên gồm Phương Mỹ Chi, NSƯT Hạnh Thúy, Huỳnh Đông, Puka, Đào Anh Tuấn... Trong đó, gương mặt gây bất ngờ nhất có lẽ là ca sĩ Phương Mỹ Chi, khi lần đầu tiên cô thử sức với vai trò nữ chính trong một bộ phim điện ảnh. Trong Nhà gia tiên, Phương Mỹ Chi đảm nhận vai Mỹ Tiên - một nhân vật ở lứa tuổi gen Z, bất đồng quan điểm với những người lớn trong gia đình và dần dần mất đi sự kết nối với các thành viên. Theo thông tin từ nhà sản xuất, bộ phim dự kiến ghi hình trong khoảng 30 ngày và sẽ ra mắt khán giả cả nước vào dịp cuối năm 2024. Phim thuộc thể loại hài - kinh dị, tập trung khai thác tình cảm gia đình và những giá trị cốt lõi bên trong một căn nhà đặc biệt được truyền qua nhiều thế hệ ông cha. Lật mặt 7 tiếp tục chiếu ở nước ngoài Sau loạt thành tích ấn tượng, dẫn đầu phòng vé Việt Nam trong suốt thời gian qua và đạt kỷ lục doanh thu, Lật mặt 7: Một điều ước sẽ tiếp tục được công chiếu tại thị trường quốc tế. Theo nhà sản xuất, Lật mặt 7 sẽ chiếu tại thị trường Bắc Mỹ và 11 quốc gia khác gồm Canada, Úc, New Zealand, Anh, Đức, Pháp, Na Uy, Thụy Điển, Cộng hòa Czech, Slovakia và Ba Lan từ ngày 14-6. Riêng tại thị trường khổng lồ Bắc Mỹ, phim sẽ được cho ra mắt vào đúng vào tuần lễ Ngày của cha (Father's Day). Trang tin Deadline dành nhiều lời khen và nhận xét rằng Lật mặt là loạt phim thành công nhất lịch sử điện ảnh Việt Nam. Lật mặt 7 hiện đang là phim thứ 3 có doanh thu cao nhất mọi thời đại tại Việt Nam và vẫn đang trong top phim bán được nhiều vé nhất trong ngày, dù đã bước sang tuần chiếu thứ 5. Jennifer Lopez hủy bỏ tour lưu diễn vì tin đồn ly hôn The Hollywood Reporter đưa tin tour diễn This Is Me… Live Tour sắp tới của Jennifer Lopez đã bị hủy bỏ với lý do nữ ca sĩ đang dành thời gian nghỉ ngơi để ở bên các con, gia đình và bạn bè thân thiết. ""Tôi thật sự cũng rất buồn vì đã khiến các bạn thất vọng. Xin hãy hiểu rằng tôi đưa ra lựa chọn này vì nó thực sự cần thiết vào thời điểm này. Tôi hứa sẽ bù đắp nhiều hơn cho các bạn. Tôi yêu tất cả mọi người rất nhiều..."" - nữ ca sĩ viết cho người hâm mộ. Thông báo này được đưa ra trong bối cảnh truyền thông đưa tin về việc Jennifer Lopez và chồng là nam diễn viên Ben Affleck đang có nguy cơ tan vỡ, khi hai người bị bắt gặp tranh cãi gay gắt nhiều lần. This Is Me… Live Tour ban đầu được ấn định sẽ khởi động vào ngày 26-6 tại Orlando (Mỹ) và kết thúc tour vào ngày 31-8 tại thành phố Houston. NewJeans lọt vào danh sách 21 Under 21 của Billboard Billboard vừa công bố danh sách 21 Under 21 vào ngày 31-5 (giờ Mỹ). NewJeans là nghệ sĩ Hàn Quốc duy nhất có mặt trong danh sách này năm nay. Danh sách 21 Under 21 của Billboard được bình chọn hằng năm, dựa trên các tiêu chí khác nhau: doanh số bán album, lượt phát trực tuyến, mức độ hiển thị trên mạng xã hội và phạm vi tiếp cận trên các đài phát thanh, truyền hình. Billboard nhấn mạnh rằng vị trí mà NewJeans đạt được là nhờ vào những thành tích xuất sắc trong suốt 2 năm kể từ khi ra mắt. Trên thực tế, NewJeans đã nhiều lần đứng đầu bảng xếp hạng Billboard 200 nhờ các ca khúc hit của mình. Trước đó, nhóm cũng từng nhận giải Nhóm nhạc của năm tại Billboard Women in Music Awards 2024. Kim Soo Hyun đến ủng hộ phim của Thang Duy, Suzy Dispatch đưa tin bộ phim điện ảnh Wonderland vừa tổ chức một buổi họp báo ra mắt phim hoành tráng vào tối 31-5, với sự tham gia của nhiều ngôi sao xứ Hàn. Đạo diễn Kim Tae Yong và dàn diễn viên chính của phim: Thang Duy, Bae Suzy, Park Bo Gum, Jung Yu Mi, Choi Woo Sik đều có mặt tại sự kiện. Wonderland là một trong những bộ phim điện ảnh được mong chờ nhất trong năm nay, phim được chiếu sau 4 năm trì hoãn do dịch COVID-19. Phim thuộc thể loại khoa học viễn tưởng, nói về sự kết nối của AI với con người trong tương lai. Trong sự kiện ra mắt phim, dàn sao nổi tiếng gồm Kim Soo Hyun, Byeon Woo Seok, Hyeri, Seohyun (SNSD)... cũng đến tham dự để ủng hộ các đồng nghiệp. Trong đó, Kim Soo Hyun và Suzy từng đóng chung bộ phim Dream High (Bay cao ước mơ), cả hai cũng trở thành đồng nghiệp thân thiết sau lần hợp tác đó. Wonderland sẽ chính thức khởi chiếu tại Hàn vào ngày 5-6 tới.",01/06/2024 16:14 GMT+7,https://tuoitre.vn/tin-tuc-giai-tri-1-6-lat-mat-7-chinh-chien-nuoc-ngoai-phuong-my-chi-dong-phim-kinh-di-20240601155755861.htm,"Một số tin tức đáng chú ý: Lật mặt 7 tiếp tục chiếu ở nước ngoài; Jennifer Lopez hủy bỏ tour lưu diễn vì tin đồn ly hôn; Kim Soo Hyun đến ủng hộ phim của Thang Duy, Suzy..."
