Title,Content,Date,Url,Summary
Vì sao có trường của Đại học Quốc gia Hà Nội không xét tuyển thí sinh thấp lùn?,"Trước đó, từ năm 2023, Trường Quản trị và Kinh doanh đã đặt ra điều kiện chiều cao đối với tất cả các ngành xét tuyển; năm 2021, 2022, riêng ngành quản trị và an ninh yêu cầu điều kiện thí sinh nữ từ 1m58, nam từ 1m65, thể lực tốt, thị giác tốt. Thông thường, chỉ những ngành nghề đặc thù mới đặt ra điều kiện về hình thể khi tuyển sinh, như các trường công an, quân đội. Cụ thể, trường quân đội tuyển thí sinh nam cao từ 1m65 trở lên, thí sinh nữ cao 1m54 trở lên. Các trường công an tuyển thí sinh nam cao từ 1m64 và nữ cao từ 1m58. Lý giải việc Trường Quản trị và Kinh doanh đưa ra tiêu chí xét tuyển đối với nữ cao từ 1m58, nam cao từ 1m65, đại diện nhà trường cho biết quy định xét tuyển của trường hướng tới mục tiêu đào tạo ra những nhà lãnh đạo, quản trị và điều hành xuất sắc cho cả khu vực công và tư. ""Trường đã trình bày rõ ràng với tổ chức kiểm định chất lượng ACQUIN Đức về sứ mệnh của nhà trường, trong đó nhấn mạnh việc không ngừng nâng cao chuẩn đầu ra của các chương trình đào tạo, đảm bảo rằng các sinh viên tốt nghiệp đều có đủ năng lực và phẩm chất để thành công trong các vị trí việc làm. Trong 5 năm qua, hàng nghìn thí sinh đã tham gia dự thi vào Trường Quản trị và Kinh doanh và đa số các bậc phụ huynh đều rất hài lòng với chất lượng đào tạo của chúng tôi. Chất lượng đầu vào và quy trình đào tạo của trường đều đạt kiểm định quốc tế, đảm bảo 100% các cử nhân có cơ hội việc làm sau khi tốt nghiệp. Trong quá trình đào tạo, chúng tôi nhận thấy rằng ngoài những yếu tố về học lực và kỹ năng, thể chất, hình thể cũng đóng một vai trò quan trọng trong việc xây dựng hình ảnh chuyên nghiệp và tự tin của các nhà lãnh đạo tương lai. Sức khỏe - đạo đức - ý chí - tài năng - tình yêu - trách nhiệm cũng là một trong những giá trị cốt lõi của sinh viên Trường Quản trị và Kinh doanh. Chúng tôi cũng muốn nhấn mạnh rằng thí sinh có năng khiếu đặc biệt vẫn sẽ được xét đặc cách. Trường luôn tạo điều kiện tối đa để các bạn trẻ có tài năng được phát triển và thành công dựa trên sự xuất sắc trong học tập và các kỹ năng khác"", đại diện nhà trường cho biết. Hiện tại, một số trường đại học ngoài khối ngành công an, quân đội cũng đặt tiêu chuẩn chiều cao khi tuyển sinh để đáp ứng yêu cầu của thị trường lao động, đòi hỏi các yếu tố ngoài trình độ, năng lực còn các yếu tố về thể chất, ngoại hình. Ngành quay phim truyền hình của Học viện Báo chí và tuyên truyền tuyển nữ cao từ 1m60, nam cao từ 1m65; ngành giáo dục quốc phòng và an ninh Trường đại học Sư phạm Hà Nội tuyển nữ cao từ 1m55, nam cao từ 1m6. Năm nay, Trường Quản trị và Kinh doanh tuyển sinh trình độ đại học chính quy 500 chỉ tiêu, gồm 4 ngành: quản trị doanh nghiệp và công nghệ; marketing và truyền thông; quản trị nhân lực và nhân tài; quản trị và an ninh.",05/06/2024 12:05 GMT+7,https://tuoitre.vn/vi-sao-co-truong-cua-dai-hoc-quoc-gia-ha-noi-khong-xet-tuyen-thi-sinh-thap-lun-20240604185204409.htm,"Năm 2024, Trường Quản trị và Kinh doanh, Đại học Quốc gia Hà Nội tiếp tục ra điều kiện xét tuyển đối với thí sinh nữ từ 1m58, nam từ 1m65, thể lực tốt, thị giác tốt."
Phổ điểm thi đánh giá năng lực chuyên biệt ĐH Sư phạm TP.HCM nhiều bất ngờ,"Trường đại học Sư phạm TP.HCM công bố phổ điểm 6 môn của 5 đợt thi trong kỳ thi đánh giá năng lực chuyên biệt năm 2024, cho thấy điểm thi tất cả các môn đều giảm so với năm 2023. 4 môn không có thí sinh đạt 10 điểm Kỳ thi đánh giá năng lực chuyên biệt năm nay được Trường đại học Sư phạm TP.HCM tổ chức thông qua 6 bài thi đánh giá năng lực: toán, vật lý, hóa học, sinh học, ngữ văn và tiếng Anh. Thí sinh có thể lựa chọn đăng ký một hoặc nhiều bài thi trong số các bài thi ở trên để đăng ký xét tuyển vào các ngành học có áp dụng phương thức tuyển sinh theo hình thức xét tuyển, dựa trên đề án tuyển sinh của trường. Kỳ thi đánh giá năng lực chuyên biệt năm 2024 có tổng cộng 5 đợt thi, nhiều nhất từ trước đến nay. Theo phổ điểm kỳ thi đánh giá năng lực chuyên biệt năm 2024 nhà trường vừa công bố, trong 6 môn thi, có đến 4 môn không thí sinh nào đạt 10 điểm gồm: vật lý, sinh học, ngữ văn và tiếng Anh. Tiếng Anh có điểm thi cao nhất, nhưng điểm trung bình thấp hơn năm 2023 Đáng chú ý, mặc dù số đợt thi và tổng số thí sinh dự thi năm 2024 đều nhiều hơn năm ngoái, nhưng phổ điểm của tất cả các môn thi trong kỳ thi năm nay đều giảm. Môn toán học có 2.770 thí sinh dự thi, điểm trung bình 6,2 (năm 2023 điểm trung bình 6,59). Ở môn thi này có 10 thí sinh đạt từ 9,5 - 10 điểm. Môn vật lý có 833 thí sinh dự thi, điểm trung bình 4,88 (năm 2023: 5,57). Môn hóa học có 879 thí sinh dự thi, điểm trung bình 5,78 (năm 2023: 6,41). Ở môn thi này có 7 thí sinh đạt từ 9,5 - 10 điểm. Môn sinh học có 280 thí sinh dự thi, điểm trung bình 5,47 (năm 2023: 6,24). Môn ngữ văn có 1.796 thí sinh dự thi, điểm trung bình 5,55 (năm 2023: 5,85). Môn tiếng Anh có 1.977 thí sinh dự thi, điểm trung bình 6,74 (năm 2023: 6,97).",05/06/2024 11:18 GMT+7,https://tuoitre.vn/pho-diem-thi-danh-gia-nang-luc-chuyen-biet-dh-su-pham-tp-hcm-nhieu-bat-ngo-20240605110424346.htm,"Trường đại học Sư phạm TP.HCM vừa công bố phổ điểm 5 đợt thi của kỳ thi đánh giá năng lực chuyên biệt năm 2024, với nhiều thông tin bất ngờ."
Có 3 phương án vận chuyển đề thi tốt nghiệp THPT ra Phú Quốc,"Ngày 5-6, Sở Giáo dục và Đào tạo Kiên Giang cho biết kỳ thi tốt nghiệp THPT năm 2024, Kiên Giang có 15.072 thí sinh dự thi, tăng 689 thí sinh so với năm 2023, bố trí 650 phòng thi tại 26 điểm thi ở các địa phương; bố trí 52 phòng dự phòng, 49 phòng chờ… Toàn tỉnh có khoảng 2.066 cán bộ, giáo viên, nhân viên làm công tác coi thi. Riêng Phú Quốc có 3 điểm thi với 62 phòng thi và bố trí 162 cán bộ coi thi, gồm: giáo viên Trường THPT Phú Quốc, Trường THPT Dương Đông và Trường THPT An Thới và trưng dụng thêm 45 giáo viên ở các trường THCS trên địa bàn Phú Quốc. Ông Thiều Văn Nam - phó giám đốc Sở Giáo dục và Đào tạo tỉnh Kiên Giang - thông tin đến nay, công tác chuẩn bị kỳ thi tốt nghiệp THPT năm 2024 ở Kiên Giang đảm bảo đúng theo kế hoạch. Tháng 6 hằng năm bị ảnh hưởng thời tiết xấu, mưa bão làm cho tàu cao tốc từ TP Rạch Giá ra Phú Quốc tạm ngưng chạy thì địa phương sẽ có 3 phương án để vận chuyển đề thi ra đảo. Thứ nhất, đơn vị có thể vận chuyển bằng đường tàu, phà từ TP Hà Tiên ra Phú Quốc. Thứ hai, địa phương sẽ vận chuyển đề thi bằng đường hàng không từ TP Cần Thơ ra Phú Quốc (nếu có chuyến bay). Thứ ba, địa phương có thể vận chuyển đề thi bằng đường hàng không từ TP.HCM ra Phú Quốc. Các thí sinh thi liên trường, liên huyện, ông Nam cho biết thêm sở cũng lưu ý địa phương và các đơn vị liên quan tổ chức đưa đón, tạo điều kiện, đảo bảo an ninh, hỗ trợ đi lại, ăn uống (đảm bảo an toàn vệ sinh thực phẩm) cho thí sinh đi thi tốt hơn và đạt kết quả cao.",05/06/2024 09:42 GMT+7,https://tuoitre.vn/co-3-phuong-an-van-chuyen-de-thi-tot-nghiep-thpt-ra-phu-quoc-20240605092544854.htm,"Do tháng 6 hằng năm có thể bị ảnh hưởng thời tiết xấu, mưa bão nên Kiên Giang có 3 phương án vận chuyển đề thi tốt nghiệp THPT năm 2024 ra Phú Quốc."
Thi vào lớp 10 TP.HCM: Tránh những sai sót không đáng,"Các thầy cô, chuyên gia có những tư vấn, lời khuyên gửi tới thí sinh, phụ huynh để tránh những ""cái chết"" không đáng có. Ngủ sớm và dậy sớm đi thi vào lớp 10 ""Nhiều năm làm công tác chủ nhiệm học sinh lớp 9, tôi thấy đa số các học sinh đi thi muộn là vì tối hôm trước thức quá khuya để ôn bài"" - thầy Tân, một giáo viên ở huyện Bình Chánh, cho biết.  Theo thầy Tân, nhiều em vì quá lo lắng nên thay vì đi ngủ sớm, giữ sức khỏe để hôm sau đi thi thì các em lại thức khuya, cố học thêm được chút nào hay chút đó. Hậu quả là sáng hôm sau rất mệt mỏi khi phải dậy sớm. Có em ngủ quên hoặc có để đồng hồ báo thức nhưng mệt quá dậy không nổi. ""Lời khuyên đầu tiên của tôi là các thí sinh hãy đi ngủ sớm vào tối 5-6 và 6-6. Học tập là một quá trình rèn luyện nối tiếp nhau từ ngày này sang ngày khác chứ cố thêm vài tiếng đồng hồ cũng sẽ không thu nạp được lượng kiến thức như mong muốn.  Bên cạnh đó phụ huynh cũng cần quan tâm đến giờ giấc sinh hoạt của con em trong những ngày này, cần canh giờ và gọi học sinh dậy, bảo đảm cho con em đến điểm thi đúng giờ"" - thầy Tân nói. Tương tự, hiệu trưởng một trường THPT ở TP.HCM kể câu chuyện buồn khi cô đi làm trưởng điểm thi vào lớp 10 cách đây vài năm. ""Khi thí sinh hớt hải chạy vào điểm thi thì đồng hồ ở điểm thi cho biết em đã đi trễ 5 phút so với quy định. Nhưng em vừa khóc vừa giơ đồng hồ của mình ra và nói em đã đến kịp giờ. Chúng tôi phải lấy nhiều đồng hồ ra so thì kết luận đồng hồ của thí sinh chạy chậm 5 phút"", vị hiệu trưởng kể. Từ câu chuyện trên, ông khuyên các thí sinh hãy đến điểm thi trước khi giám thị mở túi đựng đề thi ít nhất 45 phút. Nhiều điểm thi rất rộng, có thí sinh lại thi trên lầu cao, thời gian di chuyển từ cổng điểm thi đến phòng thi có khi mất 10 - 15 phút. Mà đâu phải đến là được vào phòng ngay, phải trình những giấy tờ cần thiết thì giám thị mới cho vào phòng thi.  ""Đi sớm một chút cũng là một cách chuẩn bị tâm thế tốt nhất để làm bài thi"" - vị hiệu trưởng tư vấn. Chuẩn bị dụng cụ từ trước ""Một trong những lỗi mà các thí sinh thường xuyên mắc phải trong kỳ thi tuyển sinh lớp 10 là quên phiếu báo danh hoặc căn cước công dân ở nhà. Không chỉ vậy, có thí sinh còn quên luôn cả hộp bút trong đó có chứa tất cả những dụng cụ cần thiết để làm bài thi như thước kẻ, bút viết, bút chì, compa... Có thí sinh đi thi môn toán nhưng lại để máy tính cầm tay ở nhà"" - một cán bộ Sở GD-ĐT TP.HCM thông tin. Theo cán bộ trên, những bất trắc này tuy sau đó đều được giải quyết bằng nhiều cách nhưng ít nhiều đều tác động không tốt đến tâm lý thí sinh. ""Tất cả giấy tờ, dụng cụ cần thiết để đem vào phòng thi cần phải soạn ra và cho vào bìa sơ mi từ tối hôm trước. Sáng hôm sau đi thi chỉ cần mang cái bìa này đi là đầy đủ. Đừng để đến khi đi thi mới vội vàng soạn đồ, rất dễ bỏ sót"" - cô Thu Huệ, giáo viên ở quận Gò Vấp, có lời khuyên cho các tình huống trên. Cô Huệ nói thêm: ""Bài học nhãn tiền từ chiếc điện thoại đã được phản ánh rất nhiều trên các phương tiện truyền thông nên tôi rất lo. Nhất là với những học sinh xem điện thoại là vật không thể thiếu bên mình.  Tôi chỉ lo các em vô phòng thi mà vẫn vô tư để điện thoại trong túi quần, lỡ cán bộ coi thi phát hiện là coi như công sức học tập 9 năm trời đổ sông đổ biển. Vì vậy, với học sinh lớp tôi là tôi dặn phụ huynh yêu cầu các con để điện thoại ở nhà"". Đừng cố về nhà buổi trưa Mùa thi tuyển sinh lớp 10 năm 2023, C.B. - học sinh lớp 9 Trường THPT chuyên Trần Đại Nghĩa - đăng ký thi vào lớp 10 chuyên tin học nên được xếp thi tại điểm Trường THPT chuyên Lê Hồng Phong. ""Nhà tôi ở quận Bình Thạnh, con lại thi tại quận 5. Mà ngày đi làm thủ tục thì thấy cũng bình thường. Ngay cả buổi sáng khi đi thi môn đầu tiên cũng thấy đi rất nhanh, có lẽ lúc đó đi sớm nên đường sá thông thoáng.  Nhưng đến trưa, khi tôi đi đón con về mới thấy khủng khiếp vì bị kẹt xe. Đường sá ken đặc xe cộ, tôi nhích từng chút một, tới khi chở được con về đến nhà thì cháu chỉ kịp ăn cơm rồi lại lên xe để ba chở đến điểm thi"" - anh Phan Thanh Hùng, phụ huynh em C.B., kể. Anh Hùng cho biết thêm: ""Hôm đó cháu nhà tôi thực sự mệt mỏi trong buổi thi chiều do buổi sáng dậy quá sớm. Đến hôm sau vợ tôi không đồng ý cho tôi chở con về nhà vào buổi trưa nữa. Cô ấy nấu cơm rồi bỏ vào hộp mang theo.  Khi đến điểm thi đón con, vợ tôi chở cháu vào nhà nghỉ ở gần đó. Con tôi ăn trưa xong, ngủ được 60 phút rồi mới đi thi buổi chiều. Tổng cộng số tiền mà vợ tôi phải trả cho nhà nghỉ chỉ có 80.000 đồng mà con mình đỡ phải đi xa, được ngủ trưa vừa khỏe khoắn vừa minh mẫn bước vào buổi thi chiều"". Từ kinh nghiệm cá nhân, anh Hùng khuyên các phụ huynh nếu nhà ở xa điểm thi thì đừng cố đưa con về nhà vào buổi trưa. Hãy tìm nhà bà con ở gần điểm thi nhờ họ cho nghỉ trưa hoặc thuê nhà nghỉ gần đó, rất thuận tiện mà giá cả cũng phải chăng.",05/06/2024 07:42 GMT+7,https://tuoitre.vn/thi-vao-lop-10-tp-hcm-tranh-nhung-sai-sot-khong-dang-20240605073854865.htm,"Sáng nay 5-6, 98.681 thí sinh sẽ đến các điểm thi ở TP.HCM để làm thủ tục dự thi vào lớp 10 năm học 2024-2025. Làm sao để tránh những bất trắc có thể xảy ra trong kỳ thi quan trọng này?"
Thi vào lớp 10: Hà Nội đề phòng sự cố đề thi bị in mờ,"Rút kinh nghiệm sự cố tại kỳ thi tuyển sinh lớp 10 năm ngoái, kỳ thi sắp tới, ngoài đề thi phát cho các thí sinh, mỗi điểm thi sẽ có bì đựng ""đề bản gốc"" dùng đối chiếu khi thí sinh, giám thị phát hiện những bất thường hay phản ánh nội dung không rõ ràng, tránh sự cố đề thi bị in mờ. Đây là điểm mới trong kỳ thi tuyển sinh lớp 10 công lập ở Hà Nội năm học 2024 - 2025. Theo ông Nghiêm Văn Bình - phó trưởng phòng phụ trách Phòng quản lý thi và kiểm định chất lượng, Sở Giáo dục và Đào tạo Hà Nội, các bì đựng ""đề bản gốc"" được đánh dấu ""bản chính"" ở bên ngoài và được niêm phong. Với môn toán, ngữ văn và các môn chuyên tự luận, mỗi bì sẽ có hai đề thi. Riêng môn ngoại ngữ thi trắc nghiệm, bì đựng đủ 24 mã đề. Để tránh sự cố đề thi bị mờ, làm ảnh hưởng tới kết quả bài thi, ông Nghiêm Văn Bình lưu ý các thí sinh cần kiểm tra kỹ đề ngay khi nhận được từ cán bộ coi thi. Quá 5 phút tính từ lúc làm bài, thí sinh hoàn toàn chịu trách nhiệm về đề thi đã nhận. Các cán bộ coi thi cũng cần nhắc nhở thí sinh về điều này để tránh việc sau 30 phút hay 1 tiếng, các em mới có ý kiến về đề thì phản ánh không có giá trị. Kỳ thi tuyển sinh lớp 10 của Hà Nội năm học 2023 - 2024 từng gặp sự cố hy hữu trong việc sao in đề thi. Tại ý 1 câu III của môn toán, ở một số đề thi, dấu gạch ngang của phương trình bị mờ, không liền mạch, khiến nhiều thí sinh lầm tưởng là dấu âm, nên làm nhầm, cho ra kết quả khác với nhiều thí sinh. Theo thống kê của Sở Giáo dục và Đào tạo Hà Nội, có khoảng 40 thí sinh gặp vấn đề này. Để đảm bảo quyền lợi cho thí sinh, hội đồng ra đề đã bổ sung đáp án câu này, chấp nhận cả đáp án của những thí sinh nhìn nhầm đề nếu các bước giải đúng. Kỳ thi tuyển sinh lớp 10 THPT công lập năm học 2024 - 2025 tại Hà Nội sẽ diễn ra trong hai ngày 8 và 9-6 với hơn 106.000 thí sinh đăng ký dự thi. Trong đó buổi sáng 8-6, thí sinh thi môn ngữ văn, buổi chiều thi môn ngoại ngữ. Sáng 9-6, thí sinh làm bài thi môn toán.",04/06/2024 21:02 GMT+7,https://tuoitre.vn/thi-vao-lop-10-ha-noi-de-phong-su-co-de-thi-bi-in-mo-20240604204325589.htm,"Năm nay, ngoài đề thi phát cho các thí sinh, mỗi điểm thi sẽ có bì đựng 'đề bản gốc' dùng để đối chiếu khi thí sinh phát hiện có điểm không rõ."
Công an hỗ trợ đưa sĩ tử mổ ruột thừa đến điểm thi ở Hải Phòng,"Công an TP Hải Phòng cho biết trong quá trình kiểm tra công tác thi tại hội đồng thi Trường THPT Hùng Thắng, trung tá Hoàng Văn Tiến - trưởng Công an huyện Tiên Lãng - nắm được thông tin trường hợp sĩ tử Nguyễn Thị Ánh Nguyệt (trú xã Hùng Thắng) dù vừa mổ ruột thừa vào đêm 3-6, nhưng vẫn tham gia kỳ thi tuyển sinh vào lớp 10, nên đã chỉ đạo đơn vị trực thuộc bố trí phương tiện để đưa đón sĩ tử này trong hai ngày thi. Theo đó, tổ công tác gồm đại úy Nguyễn Hữu Thắng - phó đội trưởng Đội cảnh sát giao thông trật tự Công an huyện Tiên Lãng và trung úy Nguyễn Văn Hiếu - cán bộ của đội này - đã dùng xe chuyên dụng của đơn vị đưa đón em Nguyệt nhằm đảm bảo sức khỏe tham dự kỳ thi. Trước đó, vào sáng 3-6, sau khi nhận phòng và số báo danh tại hội đồng thi Trường THPT Hùng Thắng, huyện Tiên Lãng thì đến đêm cùng ngày, em Nguyễn Thị Ánh Nguyệt bị đau bụng, được gia đình đưa đến Bệnh viện Đa khoa Quốc tế điều trị. Tại đây, bệnh nhân được chẩn đoán đau ruột thừa, phải mổ gấp từ 21h đến 23h cùng ngày. Sau khi mổ, Nguyệt được chuyển về khoa sản của Bệnh viện Sản nhi Quốc tế trong tình trạng sức khỏe ổn định và được sự đồng ý của bệnh viện, nên đến sáng sớm 4-6, gia đình quyết định thuê xe để đưa em tới điểm thi. Kết thúc môn thi đầu tiên, Nguyệt cho biết bạn làm bài tốt và sức khỏe đảm bảo tiếp tục thi các môn tiếp theo. Trong ngày 4-6, Hải Phòng ghi nhận nhiều trường hợp thí sinh đặc biệt.  Cụ thể, một thí sinh của Trường THCS An Đà, quận Ngô Quyền được xe cứu thương đưa đón từ nhà đến điểm thi vào lớp 10 của Trường THPT Thái Phiên. Thí sinh này vừa trải qua phẫu thuật xương do tai nạn giao thông nên được bố trí giường y tế để nằm làm bài thi. Cũng tại phòng thi riêng của điểm thi Trường THPT Thái Phiên, một thí sinh khác có bệnh tim từ nhỏ, có triệu chứng hay ngất.  Ngoài ra, một thí sinh đặc biệt khác tại điểm thi Trường THPT Hồng Bàng cũng vừa mổ ruột thừa nên được bố trí phòng thi riêng.",04/06/2024 17:27 GMT+7,https://tuoitre.vn/cong-an-ho-tro-dua-si-tu-mo-ruot-thua-den-diem-thi-o-hai-phong-20240604171243124.htm,"Ngày 4-6, Công an huyện Tiên Lãng, TP Hải Phòng bố trí xe chuyên dụng để đưa đón một sĩ tử vừa mổ ruột thừa tới điểm thi trong kỳ thi tuyển sinh vào lớp 10."
