Title,Content,Date,Url,Summary
Đề thi và gợi ý bài giải môn tiếng Anh thi vào lớp 10 TP.HCM, Ths Lê Minh Hồng Đức - THPT Vĩnh Viễn,06/06/2024 17:29 GMT+7,https://tuoitre.vn/de-thi-va-goi-y-bai-giai-mon-tieng-anh-thi-vao-lop-10-tp-hcm-20240606172019805.htm,"Tuổi Trẻ Online xin giới thiệu đề thi và gợi ý bài giải môn tiếng Anh thi vào lớp 10 TP.HCM, diễn ra chiều nay 6-6."
Tranh luận không tuyển thí sinh thấp lùn ở trường kinh doanh,"Như Tuổi Trẻ Online thông tin, năm 2024 Trường Quản trị và Kinh doanh, Đại học Quốc gia Hà Nội tiếp tục ra điều kiện xét tuyển đối với thí sinh nữ từ 1m58, nam từ 1m65, thể lực tốt, thị giác tốt. Năm nay, trường này xét tuyển thí sinh trình độ đại học chính quy 500 chỉ tiêu, gồm 4 ngành quản trị doanh nghiệp và công nghệ, marketing và truyền thông, quản trị nhân lực và nhân tài, quản trị và an ninh. Trước đó, từ năm 2023, Trường Quản trị và Kinh doanh đã đặt ra điều kiện chiều cao đối với tất cả các ngành xét tuyển. Năm 2021, 2022, riêng ngành quản trị và an ninh yêu cầu điều kiện thí sinh nữ từ 1m58, nam từ 1m65, thể lực tốt, thị giác tốt. Lý giải việc đưa ra tiêu chí xét tuyển đối với nữ cao từ 1m58, nam cao từ 1m65, đại diện nhà trường cho biết quy định xét tuyển của trường hướng tới mục tiêu đào tạo ra những nhà lãnh đạo, quản trị và điều hành xuất sắc cho cả khu vực công và tư. Nhiều bạn đọc có ý kiến khác nhau về điều kiện xét tuyển ""lạ lùng"" này. Thấp lùn không ảnh hưởng đến tài năng, đóng góp cho xã hội ""Kinh doanh mà nhìn bề ngoài, phân biệt người thấp lùn, không cho làm lãnh đạo thì không chỉ bỏ sót nhiều nhân tài, mà còn tạo văn hóa kỳ thị trong doanh nghiệp. Bất cứ doanh nghiệp nào không đối xử mọi người công bằng như nhau thì sớm muộn sẽ đối diện nguy cơ phá sản"", bạn đọc Phong Vu bày tỏ. Bạn đọc An cũng thắc mắc: ""Học quản trị kinh doanh thì cần gì cao lớn. Sao trường lại ra quy định kiểu phân biệt đối xử với học sinh như vậy. Các em không đạt tiêu chuẩn ngoại hình, nhưng vẫn đủ sức khỏe và năng lực thì không được đi học ngành này?"". Hoàn toàn phản đối cách xét tuyển này, bạn đọc Anh Vo có ý kiến: ""Đây không phải là ngành đặc thù, đề nghị Bộ GD-ĐT phải xem xét lại tính pháp lý của điều kiện xét tuyển lạ lùng trên"". Cùng quan điểm, độc giả Thinh Do viết: ""Tôi phản đối quy định kỳ thị vóc dáng thí sinh. Chiều cao hoàn toàn không ảnh hưởng gì đến mục tiêu đào tạo của trường: ""lãnh đạo, quản trị và điều hành xuất sắc"". Đề nghị Bộ GD-ĐT rà soát quy định tuyển sinh này của trường này"". ""Giáo dục là phải bình đẳng, chưa gì trường này đã tạo bất bình đẳng ngay từ đầu vào rồi"", bạn đọc Hoan nói. ""Hình thể cá nhân không ảnh hưởng đến tài năng và sự đóng góp của người đó cho xã hội. Hãy tạo điều kiện học tập cho tất cả mọi người, còn đánh giá sự thành công của một người cụ thể là công việc của cộng đồng"", độc giả Nguyễn Quang bình luận. Ngoại hình là một lợi thế? Tuy nhiên, tài khoản VT lại ""ủng hộ trường đưa ra các tiêu chuẩn về ngoại hình, bởi ngoại hình ưa nhìn là một lợi thế! Tuyển nhân viên thì đòi hỏi ngoại hình, trong khi trường tuyển sinh viên yêu cầu có ngoại hình thì sao lại phản ứng? Với điều kiện kinh tế hiện tại thì phần lớn các bạn trẻ hiện nay đều đạt tiêu chuẩn về thể lực và thể hình theo yêu cầu trên. Những thí sinh không đạt có thể chọn những trường khác không đưa ra tiêu chuẩn về ngoại hình mà học"". Tranh luận lại, bạn đọc Định Trúc viết: ""Biết là ngày nay các bạn trẻ to hơn các thế hệ trước. Tuy nhiên các em do di truyền hay lý do khác cũng đâu có muốn mình thấp lùn? Trí tuệ, chiều cao học vấn, kỹ năng… mới là quan trọng. Mong các nhà đào tạo hãy khách quan hơn với các em"". ""Trường này chắc không biết câu ""Có thể bạn không cao nhưng người khác phải ngước nhìn"" nhỉ. Các thí sinh thấp lùn đừng tự ti, quan trọng là trình độ, thái độ của các em có cao hơn người khác không kìa.  Giỏi và tự tin thì có nhỏ bé vẫn đủ khả năng lãnh đạo các em nhé"", tài khoản Người Sài Gòn nhắn gửi.",06/06/2024 16:56 GMT+7,https://tuoitre.vn/tranh-luan-khong-tuyen-thi-sinh-thap-lun-o-truong-kinh-doanh-20240606120520918.htm,Chuyện Trường Quản trị và Kinh doanh (Đại học Quốc gia Hà Nội) không xét tuyển thí sinh thấp lùn gây nhiều ý kiến tranh luận.
"Thí sinh vui vẻ ra về sau giờ thi tiếng Anh lớp 10 TP.HCM, nhiều em tự tin 9 điểm","Tại điểm thi Trường THCS Colette (Q.3), hầu hết thí sinh nhận xét đề thi môn tiếng Anh vào lớp 10 năm nay không khó. Thí sinh Phương Thanh, học sinh Trường THCS Bàn Cờ, cho biết bạn làm được hết các câu. Những câu khó tập trung ở phần viết lại câu. Thí sinh Tuấn Tài, học sinh Trường THCS Lê Quý Đôn, nói đề thi có độ khó trung bình khá, tương đương độ khó của đề thi học kỳ 2 tại trường. Các câu khó tập trung ở phần viết lại câu và từ vựng. ""Mình nghĩ có thể được 8 điểm với đề thi này"", Tài nói. Tại điểm thi THCS Ngô Tất Tố (quận Phú Nhuận), nhiều thí sinh nhận định đề thi Anh ""ăn rất dễ"". Em Nguyễn Anh Tài tự tin mình sẽ được 9-10 điểm môn này. Tại điểm thi Trường THPT Lương Thế Vinh, quận 1, nhiều thí sinh reo hò làm được bài khi ra khỏi phòng thi. Phương Lan, học sinh Trường THCS Đồng Khởi, cho biết em làm hết các câu và ước được 9 điểm. ""Em thi tiếng Anh đề án, và thấy đề thi không có kiến thức đánh đố"", Lan nói. Nhiều thí sinh khác nhận xét đề thi tương đối dễ và nằm trong SGK. Hai thí sinh Ngọc Ánh, Quỳnh Anh nhận xét: ""Đề thi chủ yếu nằm trong SGK, có một số câu phân loại nhưng em làm được hết. Em ước mình được khoảng 9 điểm"". Trong khi đó, một số thí sinh thi chuyên Anh thì cho rằng đề này dễ và em có khả năng sẽ được 10 điểm. Tuy nhiên, cũng có những thí sinh nhận xét với đề thi như thế này, em chỉ được hơn 7 điểm. ""Em thấy đề phân hóa, cũng có những câu khó và dễ sai nên em ước mình khoảng 7, 8 điểm"", Nhật Anh, thí sinh tại điểm thi này, cho biết.",06/06/2024 15:53 GMT+7,https://tuoitre.vn/thi-sinh-vui-ve-ra-ve-sau-gio-thi-tieng-anh-lop-10-tp-hcm-nhieu-em-tu-tin-9-diem-20240606094321259.htm,"Sau buổi thi môn tiếng Anh kỳ thi vào lớp 10 ở TP.HCM diễn ra chiều nay 6-6, thí sinh tại các điểm thi vui vẻ ra về với nhận xét 'đề dễ'."
"Thí sinh vui vẻ ra về sau giờ thi tiếng Anh lớp 10 TP.HCM, nhiều em tự tin 9 điểm","Tại điểm thi Trường THCS Colette (Q.3), hầu hết thí sinh nhận xét đề thi môn tiếng Anh vào lớp 10 năm nay không khó. Thí sinh Phương Thanh, học sinh Trường THCS Bàn Cờ, cho biết bạn làm được hết các câu. Những câu khó tập trung ở phần viết lại câu. Thí sinh Tuấn Tài, học sinh Trường THCS Lê Quý Đôn, nói đề thi có độ khó trung bình khá, tương đương độ khó của đề thi học kỳ 2 tại trường. Các câu khó tập trung ở phần viết lại câu và từ vựng. ""Mình nghĩ có thể được 8 điểm với đề thi này"", Tài nói. Tại điểm thi THCS Ngô Tất Tố (quận Phú Nhuận), nhiều thí sinh nhận định đề thi Anh ""ăn rất dễ"". Em Nguyễn Anh Tài tự tin mình sẽ được 9-10 điểm môn này. Tại điểm thi Trường THPT Lương Thế Vinh, quận 1, nhiều thí sinh reo hò làm được bài khi ra khỏi phòng thi. Phương Lan, học sinh Trường THCS Đồng Khởi, cho biết em làm hết các câu và ước được 9 điểm. ""Em thi tiếng Anh đề án, và thấy đề thi không có kiến thức đánh đố"", Lan nói. Nhiều thí sinh khác nhận xét đề thi tương đối dễ và nằm trong SGK. Hai thí sinh Ngọc Ánh, Quỳnh Anh nhận xét: ""Đề thi chủ yếu nằm trong SGK, có một số câu phân loại nhưng em làm được hết. Em ước mình được khoảng 9 điểm"". Trong khi đó, một số thí sinh thi chuyên Anh thì cho rằng đề này dễ và em có khả năng sẽ được 10 điểm. Tuy nhiên, cũng có những thí sinh nhận xét với đề thi như thế này, em chỉ được hơn 7 điểm. ""Em thấy đề phân hóa, cũng có những câu khó và dễ sai nên em ước mình khoảng 7, 8 điểm"", Nhật Anh, thí sinh tại điểm thi này, cho biết. Chị Hải Yến (quận Bình Thạnh) vui vẻ đón con gái hoàn thành khá tốt bài thi môn ngoại ngữ ở điểm thi THCS Trần Văn Ơn (quận 1). ""Đây là kỳ thi để con thử sức, học trường nào cũng được, miễn con vui vẻ thoải mái nên gia đình không tạo nhiều áp lực"", chị nói.",06/06/2024 15:53 GMT+7,https://tuoitre.vn/thi-sinh-vui-ve-ra-ve-sau-gio-thi-tieng-anh-lop-10-tp-hcm-nhieu-em-tu-tin-9-diem-20240606094321259.htm,"Sau buổi thi môn tiếng Anh kỳ thi vào lớp 10 ở TP.HCM diễn ra chiều nay 6-6, thí sinh tại các điểm thi vui vẻ ra về với nhận xét 'đề dễ'."
"Xôn xao đề tiếng Anh lớp 10 nằm ngoài nội dung ôn tập, sở nói gì?","Hôm nay 6-6 là ngày thi cuối cùng của kỳ thi tuyển sinh vào lớp 10 tại tỉnh Tiền Giang. Tuy nhiên từ tối 5-6, trên nhiều nhóm kín của giáo viên, phụ huynh và học sinh, mọi người bàn tán xôn xao, bày tỏ bức xúc về đề tiếng Anh (thi ngày 5-6) có phần đọc hiểu tới 2 điểm nằm ngoài nội dung ôn tập được Sở Giáo dục và Đào tạo công bố trước đó. Đề thi môn tiếng Anh năm nay có 6 trang với 56 câu dành cho chương trình hệ 7 năm và 10 năm. Nội dung được cho nằm ngoài nội dung ôn tập là từ câu 45 đến 52 dành cho học sinh hệ 10 năm.  Đây là phần đọc hiểu, sử dụng bài viết về Chùa Hương trong sách giáo khoa tiếng Anh lớp 9, trang 56. Thí sinh sẽ chọn một đáp án đúng trong dữ liệu 4 đáp án cho sẵn để điền vào chỗ trống. Câu này có 8 chỗ chừa trống, tương ứng 0,25 điểm. ""Xin hỏi quý thầy cô bài đọc trên không thuộc chủ đề ôn tập trong hướng dẫn ôn tuyển sinh, vậy ăn nói làm sao với học sinh đây ạ?"", ""Học sinh khiếu nại từ chiều giờ""... nhiều ý kiến nêu trên các nhóm kín của giáo viên, phụ huynh. Theo một giáo viên dạy tiếng Anh lớp 9 ở thành phố Mỹ Tho, câu 45 đến 52 mà phụ huynh, học sinh phản ứng thuộc bài 5 (Unit 5) trong sách giáo khoa lớp 9. Bài này không có trong tài liệu ""Cấu trúc đề thi tuyển sinh lớp 10"" ban hành kèm theo thông báo số 295 ngày 24-4-2024 của Sở Giáo dục và Đào tạo. Theo đó, nội dung ôn thi dành cho học sinh học chương trình tiếng Anh hệ 10 năm chỉ gồm các bài: City life (Unit 2), Life in the past (Unit 4), Viet Nam: Then and Now (Unit 6), Changing roles in society (Unit 11), My future career (Unit 12). Trao đổi với Tuổi Trẻ Online sáng 6-6, phụ huynh tên Minh đang chờ con trước Hội đồng thi Trường THPT chuyên Tiền Giang nói: ""Con tôi nói không làm được phần đọc hiểu có 8 câu. Do hôm nay còn thi nên nó chưa nói rõ vì sao không làm được phần đó. Tôi nghe vậy cũng thấy lo"". Theo một số thầy cô dạy tiếng Anh lớp 9, học sinh giỏi có thể làm được vài ba câu trong số 8 câu trên. Còn học sinh khá và trung bình thì khả năng mất trắng 2 điểm rất cao. Điều này sẽ ảnh hưởng không nhỏ đến điểm tổng các môn thi để xét trúng tuyển. Ông Lê Quang Trí - giám đốc Sở Giáo dục và Đào tạo tỉnh Tiền Giang - cho biết hiện nay kỳ thi tuyển sinh chưa kết thúc, hội đồng ra đề còn đang cách ly, sau khi thi xong lãnh đạo sở sẽ yêu cầu giải trình vấn đề này và thông tin cho báo chí.",06/06/2024 14:11 GMT+7,https://tuoitre.vn/xon-xao-de-tieng-anh-lop-10-nam-ngoai-noi-dung-on-tap-so-noi-gi-2024060612043145.htm,"Sở Giáo dục và Đào tạo tỉnh Tiền Giang cho biết hội đồng ra đề thi lớp 10 còn đang cách ly, sau khi thi xong sở sẽ yêu cầu giải trình và thông tin cho báo chí."
Bộ Giáo dục và Đào tạo cắt giảm 19 nội dung yêu cầu các trường công khai,"Bộ Giáo dục và Đào tạo vừa ban hành thông tư 09/2024 quy định công khai đối với cơ sở giáo dục thuộc hệ thống giáo dục quốc dân (thông tư 09). Thông tư này thay thế thông tư 36 về quy chế thực hiện công khai đối với cơ sở giáo dục và đào tạo thuộc hệ thống giáo dục quốc dân. Nhiều điểm mới về quy định công khai đối với các trường Thông tư 09 được bố cục lại theo hướng tường minh, rõ và gọn hơn, với nội dung công khai gồm hai phần: phần công khai chung đối với các cơ sở giáo dục và phần công khai riêng đối với từng cấp bậc học (giáo dục mầm non, phổ thông, thường xuyên; giáo dục đại học và trình độ cao đẳng ngành giáo dục mầm non); giảm tối đa các biểu mẫu bắt buộc cơ sở giáo dục phải kê khai (từ 21 phụ lục giảm còn 2 phụ lục trong báo cáo thường niên). Theo Bộ Giáo dục và Đào tạo, để tránh chồng chéo trong việc thực hiện công khai của cơ sở giáo dục, thông tư 09 chỉ quy định nội dung, cách thức, thời điểm công khai và nguyên tắc công khai để cơ sở giáo dục chủ động xây dựng thông tin theo chủ đề tương thích với cấu trúc của trang thông tin điện tử của các trường. Về hình thức công khai, thông tư 09 đã lược bỏ một số quy định cơ sở giáo dục phải niêm yết nội dung công khai tại cơ sở giáo dục, mà thực hiện công bố công khai đầy đủ nội dung theo quy định tại thông tư này trên trang thông tin điện tử của trường. Ngoài ra, thông tư mới còn quy định cụ thể hơn thời gian công khai trên cổng thông tin điện tử của nhà trường tối thiểu là 5 năm kể từ ngày công bố công khai. Thời gian niêm yết công khai tại trường tối thiểu là 90 ngày và đồng thời phải lưu giữ nội dung công khai tối thiểu 5 năm kể từ ngày niêm yết công khai (đối với trường không có website). Đáng chú ý, thông tư lần này bỏ quy định cơ sở giáo dục phải báo cáo kết quả thực hiện quy chế công khai của năm học trước và kế hoạch triển khai quy chế công khai của năm học sắp tới về cơ quan có thẩm quyền. Cơ quan quản lý nhà nước về giáo dục ở địa phương, các trường chỉ phải báo cáo về công tác công khai khi có yêu cầu bằng văn bản của cơ quan quản lý nhà nước có thẩm quyền theo quy định của pháp luật. Bộ Giáo dục và Đào tạo, các sở giáo dục và đào tạo, các cơ quan quản lý nhà nước có thẩm quyền khác sẽ tăng cường việc chỉ đạo, hướng dẫn, kiểm tra, thanh tra, giám sát và xử lý vi phạm theo quy định của pháp luật. Bên cạnh đó, thông tư này bổ sung quy định về nội dung báo cáo thường niên. Báo cáo thường niên không phải là bản tổng hợp lưu thông tin công khai của thông tư mà là một trong các hình thức công khai thể hiện bức tranh toàn cảnh về kết quả hoạt động của trường theo từng năm. Quy chế công khai cũ gây khó khăn cho các trường Theo Bộ Giáo dục và Đào tạo, thông tư 36 được ban hành từ năm 2017, đến nay nhiều văn bản quy phạm pháp luật liên quan đều đã được thay thế bằng các văn bản mới. Do đó, thông tư này không còn giữ nguyên tính tổng thể. Bên cạnh đó, nhiều nội dung công khai còn gắn với việc cập nhật số liệu trên cơ sở dữ liệu ngành; các yêu cầu về bảo đảm quy định bảo mật dữ liệu cá nhân, bảo vệ bí mật nhà nước theo quy định của pháp luật. Với 21 biểu mẫu ban hành kèm theo thông tư 36 chi tiết các nội dung mà trường cần công khai có nhiều nội dung chồng chéo, không còn bảo đảm thống nhất với yêu cầu quy định tại văn bản quy phạm pháp luật hiện hành: về tuyển sinh; mở ngành; bảo đảm và kiểm định chất lượng giáo dục; công khai tài chính, cơ cấu tổ chức, bộ máy đối với đơn vị sự nghiệp công, cơ sở giáo dục tư thục, phần nào gây khó khăn cho cơ sở giáo dục khi thực hiện.",06/06/2024 11:40 GMT+7,https://tuoitre.vn/bo-giao-duc-va-dao-tao-cat-giam-19-noi-dung-yeu-cau-cac-truong-cong-khai-20240606113045865.htm,"Quy chế mới về công khai đối với cơ sở giáo dục Bộ Giáo dục và Đào tạo vừa ban hành được bố cục lại gọn hơn với nội dung công khai gồm 2 phần, cắt giảm 19 phần so với quy định trước đây."
